datetime,content,title
2024-04-30 03:52:22,"周一（4月29日）纽约尾盘，美国10年期基准国债收益率下跌3.70个基点，报4.6259%，北京时间02:30跌至4.6074%，进一步脱离4月25日顶部4.7351%——2023年11月2日（顶部4.7469%）以来最高位。

两年期美债收益率跌1.46个基点，报4.9788%，盘中交投于4.9934%-4.9663%区间，4月25日也曾涨至5.0246%，逼近2023年11月14日顶部5.0475%。

三个月期国库券/10年期美债收益率利差跌3.417个基点，报-78.251个基点。

02/10年期美债收益率利差跌1.626个基点，报-35.290个基点。

美国10年期通胀保值国债（TIPS）收益率跌2.10个基点，报2.2145%，4月25日曾涨至2.3109%——逼近2023年11月13日顶部2.3577%。",10年期美债收益率跌约4个基点，受空头回补和月末交易流的冲击
2024-04-30 03:45:09,当地时间4月29日晚，埃及总统府发表声明称，埃及总统塞西同美国总统拜登通电话。通话中，双方再次强调“两国方案”在实现地区和平中的重要性，并一致表示将努力防止加沙地带冲突扩大化。（央视新闻）,埃美两国总统通话，强调必须避免加沙冲突扩大化
2024-04-30 03:42:05,"周一（4月29日）纽约尾盘，彭博谷物分类指数跌0.38%，报36.9348点。

CBOT玉米期货跌0.17%，报4.49-1/4美元/蒲式耳，北京时间22:36跌至日低4.45-1/2美元。

CBOT小麦期货跌2.29%，报6.08-1/4美元/蒲式耳，23:34跌至日低6.02-1/4美元。

CBOT大豆期货涨0.55%，报11.83-1/2美元/蒲式耳，豆粕期货涨3.02%，豆油期货跌2.61%。

ICE原糖期货涨3.46%，报19.17美分/磅；ICE白糖期货涨1.70%，报573.30美元/吨。

ICE阿拉比卡咖啡期货涨1.47%，报234.00美分/磅；罗布斯塔咖啡期货跌0.26%，报4140美元/吨，持续脱离4月25日所创历史最高位4338美元。

纽约可可期货跌13.70%，报9143美元/吨，彭博数据显示，23:55曾跌至8800美元，逼近4月4日底部8702.00美元和3月25日底部8330.00美元，较4月29日所创历史最高位11722美元回调将近24.93%。

伦敦可可期货跌17.89%，报6983美元/吨，为4月5日以来首次跌穿7000万美元整数位心理关口，逼近4月4日底部6578.00美元和3月25日底部6232.00美元，较4月19日所创历史最高位9285美元回调超24.79%。

ICE棉花期货涨0.52%。",芝加哥小麦期货跌约2.3%，纽约可可期货跌约14%，较历史最高位回调将近25%
2024-04-30 03:35:41,当地时间4月29日，伊朗经济事务与财政部长伊赫桑·汉杜齐在社交媒体表示，他同沙特经济和规划大臣费萨尔·易卜拉欣的会谈富有建设性，易卜拉欣同意了伊朗提出的5项提案，并强调将为两国公共和私营部门的经济合作规划路线图并加快落实速度。近期，汉杜齐前往沙特参加2024年伊斯兰开发银行集团会议，并同易卜拉欣举行了双边会谈。（央视新闻）,伊朗财长：将加强与沙特经济合作
2024-04-30 03:32:29,彭博数据显示，富达系列新兴市场机会基金(Fidelity Series Emerging Markets Opportunities Fund) 3月增仓台积电、药明生物和美团等，建仓小米，减仓腾讯和阿里巴巴港股，清仓阿里巴巴ADR。该基金已披露持仓规模增长2.1%，至230亿美元。,富达逾200亿美元的新兴市场基金加仓台积电，减持阿里，建仓药明生物
2024-04-30 03:21:30,"欧洲央行副行长Guindos：在抗通胀行动中仍有更多工作要做。

通胀正在走向正确的方向。

服务业通胀放缓进程陷入停滞。

未来几个月间通胀率将在当前的水平附近波动。

薪资增速出现放缓迹象。

地缘局势带来通胀上行风险。

2025年将实现2%通胀率目标，但风险很大。

如果政策传导效果加强，通胀率将可能低于预期。

欧元区经济活动状况正在逐步改善。

经济增速前景仍面临高风险，偏向下行。

重申不会预设特定的利率政策路径。",欧洲央行副行长：2025年将实现2%的通胀目标，但存在重大风险
2024-04-30 03:11:57,当地时间4月29日，据俄新社援引美国财政部消息报道，美国政府允许在2024年11月1日前，与俄罗斯部分银行进行能源领域交易的相关结算。被允许进行交易结算的俄罗斯银行包括俄罗斯外贸银行、俄罗斯储蓄银行、阿尔法银行和圣彼得堡银行等大型银行。此外根据规定，相关结算也可以与俄罗斯央行进行。此前根据美国政府发布的行政令，上述操作属于制裁范围而被禁止。（央视新闻）,美允许与俄部分银行进行能源领域交易相关结算
2024-04-30 03:04:05,标普500指数与纳斯达克100指数转为下跌。,
2024-04-30 03:01:24,"美国财政部将对本季度联邦借款规模的预估上调至2,430亿美元（1月底发布的预估值2,020亿美元），高于大多数交易商的预期，此举在很大程度上反映了现金收入低于官员预期。美国债务管理机构对财政部6月底现金余额的预估维持在7,500亿美元不变。财政部表示，这一上调“主要是由于现金收入减少”，但本季度初现金余额增加部分抵消了这类收入减少。","美国财政部：将本季度借款预估上调至2,430亿美元"
2024-04-30 03:01:00,在岸人民币兑美元北京时间03:00收报7.2250，较上一交易日夜盘收盘涨215点。成交量353.12亿美元。,
2024-04-30 03:00:39,"恒生指数主连夜盘收涨0.09%，报17697.00点。

恒生科技指数主连夜盘收涨0.35%，报3730.00点。",
2024-04-30 02:54:14,"格力电器公告：一季度营收363.6亿元人民币。

一季度净利润46.8亿元人民币，市场预期32.1亿元人民币。

2023年度全年营收2039.8亿元人民币，市场预期2052亿元人民币。

2023年度全年利润290.2亿元人民币，市场预期274.7亿元人民币。

公司向全体股东每10股派发现金红利23.80元（含税）。",格力电器：2023年全年利润超预期，每10股派发现金红利23.80元
2024-04-30 02:34:51,"WTI 6月原油期货收跌1.22美元，跌幅1.45%，报82.63美元/桶。

布伦特6月原油期货收跌1.10美元，跌幅1.23%，报89.50美元/桶。

NYMEX 6月天然气期货收涨5.56%，报2.0300美元/百万英热单位。

NYMEX 5月汽油期货收报2.7487美元/加仑，NYMEX 5月取暖油期货收报2.5313美元/加仑。",国际原油价格显著回落
2024-04-30 02:31:54,"上期所原油期货2406合约夜盘收跌1.13%，报645.10元人民币/桶。

沪金夜盘收跌0.21%，沪银收跌0.31%。",
2024-04-30 02:30:44,微软、谷歌将与日本城市合作，以制定在政府服务中使用人工智能的指导方针。亚马逊网络服务及甲骨文的日本分公司也将参与其中。（日经新闻）,
2024-04-30 02:09:17,嘉能可大股东们倾向于保留煤炭业务，而不希望拆分。（彭博）,
2024-04-30 01:58:33,"摩根大通分析师Marko Kolanovic：美国股市恐怕会重演2023年夏季（8月份开始）的“昏迷”行情。

美联储“更长时期内维持更高利率”的可能性让2024年的股市上行前景承压。",
2024-04-30 01:57:22,汽车经销商组织：特斯拉一季度美国加州销量下滑7.8%。,
2024-04-30 01:51:12,当地时间4月29日，乌克兰敖德萨州军事行政长官基佩尔表示，当天敖德萨遭俄导弹袭击，导致3人死亡、20人受伤。敖德萨一建筑的屋顶几乎被烧毁。紧急服务部正在现场进行救援。俄罗斯方面对此暂无回应。（央视新闻）,乌克兰敖德萨遭导弹袭击，已致3人死亡
2024-04-30 01:50:30,据巴勒斯坦通讯社消息，当地时间4月29日，巴勒斯坦总统阿巴斯在沙特首都利雅得与沙特王储兼首相穆罕默德·本·萨勒曼举行会谈，讨论巴以局势。在会谈中，阿巴斯向穆罕默德介绍了巴以局势最新发展。阿巴斯重申，巴方坚决反对任何迫使巴勒斯坦人流离失所的企图和行为。他还强调，继续支持联合国近东巴勒斯坦难民救济和工程处（近东救济工程处）的重要性。穆罕默德重申沙特一贯支持巴勒斯坦事业的坚定立场。他还强调，沙特将继续努力以促成加沙地带实现停火，并帮助人道主义救援物资尽快进入该地区。（央视新闻）,巴勒斯坦总统与沙特王储兼首相会谈，讨论巴以局势
2024-04-30 01:49:36,美国银行业监管部门（美联储、FDIC、OCC等）将于5月份出席国会山听证会。（PunchBowl）,
2024-04-30 01:44:40,意大利料将批准向低收入家庭发放100欧元现金津贴。（彭博）,
2024-04-30 01:43:18,津巴布韦央行维持关键利率在20%不变，这是该国采用新货币ZiG以来举行的首次货币政策会议。,
2024-04-30 01:35:20,"甲骨文总部已于2020年12月份从美国加州迁往得州奥斯丁。

但加州办公司的员工人数超过得州。",
2024-04-30 01:34:01,三名漫画家和摄影师（即将）起诉谷歌公司，指控其Imagen AI软件模型数十亿规模的训练涉嫌侵犯他们的版权。（彭博）,
2024-04-30 01:32:06,"波音公司发行100亿美元公司债，获得大约八倍认购（总额大约770亿美元），到期时间从三年到40年、共六种到期时间。

此前，波音发生季度亏损，烧钱39亿美元，穆迪下调该公司评级至更加接近垃圾级的档次。",波音发行100亿美元公司债，获得大约八倍认购
2024-04-30 01:30:41,今年2月份以来，鸡蛋价格出现持续下跌，部分地区的价格已经跌到了每斤3元左右，和去年同期相比，下跌已超两成。鸡蛋价格行情的持续低迷，一方面是由于蛋鸡存栏量处于高位，鸡蛋供应充足，另一方面也和当前鸡蛋的需求较弱有关。很多鸡蛋贸易商都降低了采购量，谨慎补货。卓创资讯鸡蛋分析师刘旭：指出5月至6月份处在鸡蛋的消费淡季，节日效应对鸡蛋需求量的拉动作用比较有限。因此，预计在未来一段时间，全国鸡蛋价格将维持在低位调整，到6月中后期价格有小幅下跌的趋势。（央视财经）,部分地区鸡蛋跌至每斤3元水平，分析师称蛋价后市仍将低位徘徊
2024-04-30 01:25:19,可口可再次乐考虑最快于2025年将其非洲灌装业务Coca-Cola Beverages Africa二次IPO——南非约翰内斯堡和荷兰阿姆斯特丹，寻求通过IPO获得超过80亿美元估值。（彭博）,
2024-04-30 01:21:54,"LVMH集团（MC.FP）收跌1.64%，报779.20欧元。

思爱普（SAP.GR）收跌1.48%，报171.420欧元。

阿斯麦控股荷兰阿姆斯特丹股价（ASML.NA）收跌1.29%，报847.70欧元。

诺华制药（NOVN.SW）收跌0.70%，雀巢（NESN.SW）收跌0.67%，诺和诺德哥本哈根股价（NOVOB.DC）收跌0.20%。

罗氏控股（ROG.SW）收涨0.09%，欧莱雅（OR.FP）收涨0.20%，阿斯利康（AZN.LN）收涨0.30%，赛诺菲（SAN.FP）收涨0.67%，葛兰素史克伦敦股价（GSK.LN）收涨1.03%。",欧股“十一罗汉”｜LVMH集团和阿斯麦至少收跌约1.3%，此外ASM国际和爱思强股份跌超4%
2024-04-30 01:19:38,当地时间4月29日，卡塔尔首相兼外交大臣穆罕默德在沙特首都利雅得出席世界经济论坛全球合作增长和能源发展特别会议期间与英国外交大臣卡梅伦举行会谈。除了双边关系，双方重点就巴以最新局势进行了讨论。双方强调，必须寻找到缓和中东地区紧张局势、实现和平稳定的有效路径，必须尽快结束加沙地带冲突，并加快向加沙地带运送人道主义援助物资。（央视新闻）,卡塔尔首相会见英国外交大臣，讨论巴以局势
2024-04-30 01:16:42,周一（4月29日），美联储隔夜逆回购协议（RRP）使用规模为5055.30亿美元，上个交易日报4649.12亿美元。,FOMC货币政策会议开幕前夕，美联储逆回购工具使用量反弹至超过5000亿美元
2024-04-30 01:16:27,共享办公室公司WeWork与包括软银在内的主要财务支持者们达成新版重组协议，将Adam Neumann排斥在外。,
2024-04-30 01:12:29,据OpenAI，记忆功能向ChatGPT Plus用户全面开放。使用记忆功能非常简便：只需要启动一个新的聊天窗口，将用户自己想要程序保存的信息告诉ChatGPT。可以在设置中打开或关闭记忆功能。当前，欧洲市场和韩国市场还没有开放这项功能。预计下一步将向团队、企业、GPTs用户开放（这一功能）。,OpenAI：记忆功能向ChatGPT Plus用户全面开放
2024-04-30 01:04:04,"欧洲央行管委Knot：欧洲央行可能会在6月份降息，央行必须在之后保持谨慎。

现在讨论欧洲央行6月份之后的政策会议还言之过早。

（欧元区）季度薪资数据乃帮助欧洲央行调整货币政策的关键。

美国的通胀经验表明，（欧元区也）需要保持警惕。",
2024-04-30 01:00:16,"国际铜夜盘收涨1.51%，沪铜收涨1.49%，沪铝收平，沪锌收涨2.32%，沪铅收涨0.70%，沪镍收涨1.83%，沪锡收涨0.74%。

氧化铝夜盘收跌1.45%。

不锈钢夜盘收涨0.52%。",沪锌夜盘收涨超2.3%，沪镍、国际铜、沪铜至多涨超1.8%，氧化铝则跌超1.4%
2024-04-30 00:57:40,"LME期铜收涨170美元，涨幅超过1.70%，报10136美元/吨，为2022年4月份以来首次收于1万美元整数位心理关口上方。

LME期铝收涨20美元，报2590美元/吨。

LME期锌收涨100美元，涨超3.51%，报2944美元/吨。

LME期铅收涨23美元，报2230美元/吨。

LME期镍收涨48美元，报19148美元/吨。

LME期锡收涨155美元，报32566美元/吨。

LME期钴收平，报27830美元/吨。",伦铜站上1万美元关口，收涨1.7%，伦锌涨超3.5%
2024-04-30 00:52:22,4月29日晚，A股2023年年报披露收官。截至4月29日23时30分，A股共有5256家上市公司对外披露2023年年报，3031家上市公司实现营业收入同比增长，2683家上市公司实现归属于上市公司股东的净利润同比增长。剔除金融股影响，中国石油、中国移动、中国海油、贵州茅台、中国石化、中国神华、中国建筑、宁德时代、美的集团、中国中铁10家上市公司问鼎A股“盈利王”。从年度累计分红总额（已宣告）看，工商银行、建设银行、中国移动、农业银行、中国石油、中国银行、贵州茅台、中国海油、招商银行、中国神华等10家公司计划分红金额最高，问鼎A股“分红王”。（中证报）,A股年报披露收官，十大“盈利王”“分红王”出炉
2024-04-30 00:46:15,"美元兑日元短线下挫超100点，至155.50一线，日内整体跌幅重新扩大至1.66%。

彭博美元指数跌幅扩大至0.5%，刷新2月1日以来低点至1256.57点。

ICE美元指数目前跌0.27%，暂报105.653点，亚太午盘曾跌至日低105.462点。",日元短线走高，彭博美元指数跌幅扩大至0.5%
2024-04-30 00:22:53,"周一（4月29日）欧市尾盘，德国10年期国债收益率跌4.3个基点，报2.532%，北京时间19:55跌至2.507%，全天处于下跌状态，4月25日涨至2.648%逼近2023年11月27日顶部2.650%以来，连续第二个交易日回调。

两年期德债收益率跌2.6个基点，报2.962%，19:54跌至日低2.943%，全天处于下跌状态；30年期德债收益率跌4.6个基点，报2.664%。

2/10年期德债收益率利差跌1.671个基点，报-43.075个基点。",10/30年期德债收益率跌超4个基点
2024-04-30 00:21:28,经历了A股市场强震、IPO逆周期调节之后，证券公司的营收和净利普降。以“证券承销业务净收入”指标进行业内比较，已披露一季报的40家上市券商中，共有30家券商出现下滑，占比75%。而就在不久之前公布的2023年年报中，超九成的券商投行业务净收入都出现了下滑。备受关注的投行业务收入毫无意外地持续下滑。强基础、修内功、调方向成为当下证券行业的共识。“IPO逆周期调节下，各家券商投行根据自身优势，有的发力区域性金融债的发行，有的重点关注以上市企业和拟辅导企业的再融资，”北方某中小券商的相关业务负责人分析到，“当然，北交所也是重点。”（中国基金报）,超七成券商投行营收下滑，调整业务方向成业内共识
2024-04-30 00:21:13,上周科技股在风险偏好推动下的上涨并没有被对冲基金错过，他们的买进速度达到一年多来最高。高盛的大宗经纪业务部门数据显示显示，上周对科技股的净买入达到2022年12月来最高，因多头头寸和空头回补增加。对冲基金连续第四周成为该板块的净买家，而标普500信息技术指数因为高利率担忧而在4月份大部分时间都下跌。对冲基金的买盘看起来很有先见之明，因为上周谷歌母公司Alphabet和微软的业绩提振了投资者对科技业基本面的乐观情绪。（彭博）,高盛：上周对冲基金对美国科技股的净买入达到一年多来最高
2024-04-30 00:19:20,临床阶段制药公司Annovis Bio Inc.（ANVS）一度跌约70%，刷新2020年10月份以来盘中低点至5.23美元，该公司针对轻度至中度阿尔茨海默症（AD）患者疗法的2/3阶段临床试验结果让人感到失望——达到一个主要终点、但没能实现另外一个主要终点。,
2024-04-30 00:14:19,"Heartland Financial（HTLF）维持将近20%的涨幅，最高触及42.77美元，创2023年3月初以来盘中新高。

UMB金融（UMBF）则一度跌约6.5%，报76.00美元，逼近2023年12月中旬最低位。

UMB金融同意以大约20亿美元收购竞争对手Heartland Financial，预计这将成为2024年美国最大一笔地区银行领域的交易。",UMB金融将以约20亿美元收购地区银行竞争对手Heartland，后者股价涨约20%
2024-04-30 00:09:31,"英国海军：也门西北部海域一艘货轮称损毁得到控制。

船只和船员目前是安全的，货轮继续前往下一个目的地港口。",
2024-04-30 00:00:31,"法国10年期国债收益率跌6.2个基点，报3.004%，北京时间19:55跌至日低2.983%。

意大利10年期国债收益率跌6.9个基点，报3.856%，23:04跌至日低3.839%。

西班牙10年期国债收益率跌5.7个基点，报3.303%。

希腊10年期国债收益率跌6.2个基点，报3.531%。",10年期意债收益率跌约7个基点，下探3.84%
2024-04-29 23:58:49,4月29日晚间，贵州省人民政府网官方微信公众号发布任免职的通知，丁雄军任贵州省市场监督管理局（贵州省知识产权局）局长。当日晚间，贵州茅台发布公告称，根据贵州省人民政府相关文件，推荐张德芹为贵州茅台董事、董事长人选，建议丁雄军不再担任公司董事长、董事职务。,丁雄军任贵州省市场监督管理局局长
2024-04-29 23:58:38,"周一（4月29日）欧市尾盘，英国10年期国债收益率下跌3.1个基点，报4.293%，北京时间22:59跌至日低4.275%。

两年期英债收益率跌2.1个基点，报4.455%，22:33曾跌至日低4.434%。

30年期英债收益率跌2.9个基点，50年期英债收益率跌2.9个基点。

2/10年期英债收益率利差跌0.957个基点，报-16.284个基点。",10-50年期英债收益率跌约3个基点
2024-04-29 23:55:27,"南非富时/JSE非洲领先40可交易指数收涨1.49%，报70391.06点。

成分股英美铂业（AMS.SJ）收涨5.54%领跑，英美公司（AGL）涨约3.2%，大型煤炭和重矿物开采公司爱索资源（EXX）收涨1.7%，嘉能可（GLN）涨约0.5%表现靠后，Naspers（NPN）则收跌0.2%表现倒数第五，Prosus（PRX）收跌0.59%跌幅第二大，瑞士历峰集团（CFR）跌0.93%。

南非兰特兑美元目前涨0.9%，刷新日高至18.6341兰特，处于连续第三个交易日上涨之中——累计涨幅已经超过3.0%。

毛里求斯证交所SEMDEX指数收跌0.24%，尼日利亚证交所全部股指收跌0.22%，肯尼亚内罗毕证交所全股指数收跌0.72%。",非洲股市｜南非股指收涨约1.5%，兰特三天已升值超3%
2024-04-29 23:55:03,当地时间4月29日，巴勒斯坦伊斯兰抵抗运动（哈马斯）发表声明称，如果不能就实现加沙地带永久停火、以军撤离以及所有地区难民返回家园达成协议，任何协议都不会取得成果。（央视新闻）,哈马斯发表声明称加沙永久停火是达成协议的基础
2024-04-29 23:53:00,据巴勒斯坦媒体当地时间4月29日报道，以军自当日凌晨开始对加沙地带的袭击已造成34人死亡，其中对南部城市拉法的轰炸造成的死亡人数已上升至26人。（央视新闻）,巴媒称以军袭击加沙地带，已致34人死亡
2024-04-29 23:51:41,中共中央政治局委员、外交部长王毅29日在北京同秘鲁外长冈萨雷斯－奥莱切亚举行会谈。王毅表示，中方愿同秘方共同落实好两国元首重要共识，弘扬传统友谊，以高水平政治互信带动高质量互利合作，推动中秘全面战略伙伴关系迈上新台阶。愿同秘方加强发展战略对接，尽快完成自贸协定升级谈判。支持秘方举办2024年亚太经合组织领导人非正式会议。冈萨雷斯－奥莱切亚表示，秘方支持中方提出的构建人类命运共同体理念，欢迎中方倡导的“三大全球倡议”以及平等有序的世界多极化、普惠包容的经济全球化。秘方坚定恪守一个中国原则。（新华社）,王毅同秘鲁外长冈萨雷斯－奥莱切亚会谈
2024-04-29 23:51:04,"摩根士丹利策略师Michael Wilson：即使利率保持在当前水平，在未来两到三个月市盈率也面临大约7%的下行空间。

如果10年期国债收益率在7月中旬之前直线上升至5%，那么市盈率下行空间将扩大至11%左右。

不过，利率压力在6月之后会减弱。",
2024-04-29 23:50:33,摩根士丹利策略师Michael Wilson表示，美国国债收益率上升带来的压力正在令乐观的美国公司财报季失去光彩。这位策略师表示，尽管盈利超过分析师预期的公司比例“强劲”，但股价的反应仍然平淡，因为今年突破历史高位的涨势已经抬高了股票估值。Wilson称：“我们认为这是由于利率上升对估值构成压力，这种情况可能会在短期内持续，” 除非美联储本周的政策会议显示出鸽派倾向。,大摩策略师Wilson：国债收益率上升令财报季黯然失色
2024-04-29 23:48:13,三菱日联信托银行销售和交易业务负责人Takafumi Onodera表示，日本当局在假期市场淡静的环境下出手干预是有道理的，因为美元/日元的走势能够更加明显。 他表示，日元走势看起来像是存在干预的，但要得到官方确认，市场将不得不等待5月底的数据发布。,机构：淡静的市场环境是日本当局出手干预的好时机
2024-04-29 23:46:46,据乌克兰国家通讯社29日报道，北约秘书长斯托尔滕贝格当天在基辅与乌克兰总统泽连斯基举行会晤后宣布，他邀请泽连斯基出席今年7月在华盛顿举行的北约峰会。斯托尔滕贝格说，北约已就加强对乌安全支持和训练乌军士兵的计划达成一致。他认为有必要将北约各国单独对乌支持转变为北约联合对乌支持，以确保北约对乌支持的“长期性和可预测性”。泽连斯基说，他与斯托尔滕贝格还讨论了由北约出资成立乌克兰国防特别基金事宜。按照计划，北约将在5年内向该基金提供1000亿欧元支持。泽连斯基还说，美国日前宣布的新军事援助已开始运抵乌克兰。（新华社）,北约秘书长邀请乌克兰总统出席北约峰会
2024-04-29 23:43:42,"周一（4月29日）欧市尾盘，ICE英国天然气期货跌3.99%，报69.000便士/千卡。

TTF基准荷兰天然气期货跌4.92%，报28.050欧元/兆瓦时。

ICE欧盟碳排放交易许可（期货价格）跌0.90%，报65.00欧元/吨。",荷兰天然气期货跌超4.9%，英国天然气期货也跌约4%
2024-04-29 23:40:57,阿根廷大豆压榨行业将罢工，以反对总统米莱的最新版（税收/财政）草案。,
2024-04-29 23:35:17,智利国家铜业公司（Codelco）董事会主席：在5月底的截止日期之前，公司仍然与智利化工矿业（SQM）洽谈锂（矿产）业务。,
2024-04-29 23:32:15,"美国财政部拍卖三个月期国债，得标利率5.250%（4月22日报5.253%），投标倍数2.67（前次为2.78）。

拍卖六个月期国债，得标利率5.165%（4月22日报5.160%），投标倍数2.98（前次为2.80）。",
2024-04-29 23:32:01,中国银行与中国华电签署全面战略合作协议及绿色发展专项合作协议。中国银行董事长葛海蛟表示，中国银行将以此次签约为契机，聚焦绿色金融、科技金融、全球化和综合化业务等重点领域，不断提升金融服务质效，推动双方战略合作走深走实。,中国银行与中国华电签署全面战略合作协议
2024-04-29 23:30:29,"德国DAX 30指数初步收跌0.15%，报18133.72点。

法国股指初步收跌0.17%，意大利股指初步收涨0.12%，英国股指初步收涨0.11%。",
2024-04-29 23:30:22,"欧洲STOXX 600指数初步收涨0.11%，报508.53点。

欧元区STOXX 50指数初步收跌0.44%，报4984.72点。

富时泛欧绩优300指数初步收涨0.05%，报2016.47点。",
