datetime,content,title
2024-04-30 23:56:01,"Prosus于4月22-26日期间回购5,502,741股股票，均价31.0188欧元，总额170,688,646欧元（折合182,413,834美元）。",
2024-04-30 23:51:46,以军4月30日发布相关视频并称，以军第98师和第162师近日一直为在巴勒斯坦加沙地带发动攻势、在拉法进行军事行动而进行密集准备。以军在声明中称，这两个师“正努力加强在加沙地带继续战争的准备工作”，并且都已讨论了即将采取的军事行动计划。 （CCTV国际时讯）,以军发视频称为地面进攻拉法做准备
2024-04-30 23:45:04,据以色列媒体报道，4月30日，以方谈判代表将前往埃及首都开罗，参加与哈马斯的停火谈判。而哈马斯代表团已经于29日暂时离开开罗，对最新停火方案进行内部讨论。据埃及安全部门消息人士称，哈马斯代表团于29日晚些时候离开埃及首都开罗，将带着对停火谈判的书面回应返回。法新社4月30日援引消息人士的说法报道，哈马斯代表团已返回卡塔尔，正在讨论最新方案，并表示希望能“尽快作出回应”。以色列方面表示，这是以军在拉法发动地面行动前达成协议的“最后机会”。（央视新闻）,以色列代表团4月30日前往开罗参与停火谈判
2024-04-30 23:42:01,4月30日，据华尔街见闻确认，华为内部发布了人事调整文件，宣布余承东将卸任华为终端BG CEO一职，将担任终端BG董事长职位。原华为终端BG、首席运营官何刚接任华为终端BG CEO。此外，有知情人士对华尔街见闻表示，华为公司拥有完善的内部治理架构，此次为正常管理任命。让余承东有更多的精力为消费者打造精品。（全天候科技）,余承东卸任华为终端BG CEO
2024-04-30 23:35:10,美国财长耶伦：高通胀在很大程度上系“供应链冲击的消退”所致。,
2024-04-30 23:32:51,美国财政部拍卖42天期现金管理票据，得标利率5.285%，与4月23日和4月16日持平。,
2024-04-30 23:32:25,"德国DAX 30指数初步收跌1.02%，报17934点。

法国股指初步收跌1.1%，意大利股指初步收跌1.52%，英国股指初步收跌0.04%。",
2024-04-30 23:32:19,欧洲STOXX 600指数初步收跌0.72%，报504.67点。,
2024-04-30 23:23:44,"欧元区STOXX 50指数跌幅扩大至1%，暂报4930.91点。

成分股中，LVMH集团跌幅重新扩大至超过0.6%。",
2024-04-30 23:21:12,挪威首相斯特勒4月30日说，挪威希望与中国加强在各领域的交流与合作。斯特勒当天在首都奥斯陆参加了挪威外国记者协会组织的首相与外国记者见面会。他在回答新华社记者提问时表示，挪威希望加强与中国在各领域尤其是在人工智能、应对气候变化、国际贸易等领域的交流与合作。他说，这些全球性问题，需要包括挪威和中国在内的国际社会共同参与才能得到解决。今年是中国与挪威建交70周年。斯特勒表示，挪威与中国在外交、政治、经贸等领域都有广泛交流。挪威政府将继续加深与中国的合作，并保持各领域沟通渠道畅通。（新华社）,挪威首相说希望与中国加强在各领域的交流与合作
2024-04-30 23:10:17,"纳斯达克100指数跌幅扩大至0.8%，GE Healthcare Technologies跌11.6%创美国IPO以来最大盘中跌幅，华纳兄弟探索跌8.8%，特斯拉跌5.2%——在4月29日收涨15.3之后回吐涨幅，阿斯麦ADR跌1.7%，英特尔跌超1.2%，莫德纳则涨1.1%，安森美涨1.4%，Mercadolibre涨超2%，恩智浦涨3.4%，PayPal涨3.4%。

标普500指数跌幅扩大至0.7%，11个板块几乎全军覆没，能源板块跌超1.3%，可选消费和原材料板块跌超1.2%，科技板块跌超0.4%，电信板块跌超0.2%跌幅最小，保健板块目前涨超0.1%。

道指下跌290点，跌幅扩大至0.76%，卡特彼勒跌3.5%目前表现最差，英特尔、沃尔玛、雪佛龙、微软、耐克、Salesforce、思科、联合健康、IBM至少跌约1.1%，苹果涨幅不足0.3%，摩根大通涨0.4%，3M涨4.67%。",美国股市跌幅扩大，特斯拉跌超5%，标普能源、可选消费、原材料板块跌超1%
2024-04-30 23:07:03,摩根大通：预计可可中期内将回落至6000美元/吨。,
2024-04-30 23:02:09,"现货白银日内跌幅达3.0%，报26.31美元/盎司。

COMEX白银期货下跌4.0%，报26.55美元/盎司。",
2024-04-30 23:00:52,"美国财政部将发行700亿美元四周期国债和750亿美元八周期国债。

将发行600亿美元四个月期国债。",
2024-04-30 23:00:18,两名地方官员表示，伊拉克库尔德斯坦地区Khor Mor天然气田将于数小时内恢复运营。,
2024-04-30 22:59:12,深交所发布关于终止对华一股份首次公开发行股票并在创业板上市审核的决定。,深交所：终止对华一股份首次公开发行股票并在创业板上市审核
2024-04-30 22:56:09,深交所发布关于终止对高义包装首次公开发行股票并在主板上市审核的决定。,深交所：终止对高义包装首次公开发行股票并在主板上市审核
2024-04-30 22:55:35,当地时间4月30日，据美国有线电视新闻网（CNN）报道，负责审理美国前总统特朗普“封口费”刑事案的法官胡安·梅尔尚表示，由于特朗普在“封口费”案中九次违反禁言令的行为构成了藐视法庭罪，因此法官对其处以9000美元的罚款。据悉，特朗普必须在当日14时15分之前从社交软件和竞选网站上删除9个“违规帖子”。法官警告称，法院不会容忍继续故意违反其合法命令的行为，并将在必要情况下施加监禁处罚。（央视新闻）,因在“封口费”案中违反禁言令，特朗普再被罚款
2024-04-30 22:52:05,"美国上个交易日（4月29日）担保隔夜融资利率（SOFR）报5.32%，之前一天报5.32%。

上个交易日有效的联邦基金利率报5.33%，之前一天报5.33%。",
2024-04-30 22:50:51,"周二（4月30日），沙特证交所全股指数收涨0.21%，报12394.91点，4月份累计下跌0.05%。

沙特阿美（ARAMCO.AB）收平，报30.10沙特里亚尔，4月份累跌2.43%。

卡塔尔证交所指数收跌0.17%，报9727.01点，4月份累跌1.22%。

科威特证交所超级市场价格回报指数收涨0.12%，报7691.50点，4月份累跌4.30%。

埃及证交所EGX 30指数收跌6.01%，报24448.73点，逼近2023年12月27日收盘位24351.12点、2.4万点整数位心理关口、以及当年12月26日收盘位23994.54点，4月份累跌9.06%，4月18日曾涨至30072.10点创盘中历史最高。

埃及镑兑美元收涨0.06%，报47.8802埃及镑，4月份累计贬值约1.32%。

迪拜金融市场综合指数收跌0.12%，报4155.77点，4月份累跌2.51%。

阿布扎比证券市场综合指数收涨0.05%，报9067.42点，4月份累跌1.74%。",中东股市｜4月份沙特股指大致持平，科威特股指累跌超4%，埃及股指累跌超9%
2024-04-30 22:40:55,"美国财长耶伦：美国（财政）赤字“何去何从”让我感到忧心忡忡。

美国需要“一系列大刀阔斧的行动”，以便降低预算赤字。",
2024-04-30 22:40:31,近期，市场监管总局联合中国人民银行建立人民币现金机具认证制度，发布了认证目录和规则，2024年5月1日开始实施。该认证制度的建立将进一步健全阻截假币的重要金融基础设施，为金融强国和质量强国建设提供支撑。下一步，市场监管总局将联合中国人民银行推进人民币现金机具认证工作有效实施，推动行业管理、市场流通等领域采信认证结果，提升反假币工作水平，保护公众合法权益，保障货币流通秩序与国家金融安全。（市场监管总局）,两部门建立实施人民币现金机具认证制度，积极维护国家金融安全
2024-04-30 22:39:28,国际油价短线走低，日内跌幅扩大至2%，WTI原油期货跌穿81美元/桶，为4月23日以来首次，布伦特原油刷新3月27日以来低点至85.45美元。,
2024-04-30 22:33:33,"“新美联储通讯社”Nick Timiraos：美联储官员们称（FOMC货币）政策“处于良好状态”或“准备充分”时，其实并不意味着一切都那么完美。

实际上，他们认为，自己针对形势不尽如人意掌握着合理的应对选项。",
2024-04-30 22:21:42,"据知情人士透露，LVMH集团接触多家顾问，为Marc Jacobs研究诸多选项。

该公司Marc Jacobs品牌可能会吸引到私募的（战略性投资/收购）兴趣。（彭博）",
2024-04-30 22:18:13,4月30日21时30分，香港天文台发布黄色暴雨警告信号。（央视）,
2024-04-30 22:15:25,恒大汽车港交所公告，本集团2023年营业额为人民币13.4015亿元，相比截至2022年12月31日止年度的营业额增加900.04%。收入增加主要由于汽车及汽车零部件销售额从截至2022年的人民币0.6063亿元增长至报告期的人民币1.4632亿元；物业销售的收入增加人民币11.3637亿元。,恒大汽车年报：2023年营业额增超900%
2024-04-30 22:10:34,据希伯来语媒体报道，围绕有关交换被扣押人员的协议以及对拉法进行军事行动的潜在影响等问题，以色列战时内阁成员之间存在严重分歧，原定于当地时间4月30日晚举行的以色列战时内阁会议被取消。去年10月以来，以军在加沙地带由北向南发动地面攻势，战火目前蔓延至拉法市。内塔尼亚胡已批准以军在拉法开展地面行动，以军近期加大对拉法的空袭。国际社会普遍反对以色列攻打拉法，担忧以军行动会使加沙地带陷入更严重的人道主义危机。（央视新闻）,分歧严重，以色列战时内阁会议被取消
2024-04-30 22:03:04,美国4月谘商会消费者信心指数降连续第三个月下降，至97，低于所有分析师的预期。美国消费者对劳动力市场和对经济前景的看法恶化。,美国消费者信心降至2022年7月份以来新低
2024-04-30 22:01:29,国家金融监督管理总局网站4月30日披露罚单，陆家嘴国际信托有限公司因报送监管部门的报告报表不真实、关联方和关联交易数据不真实、以投资名义向不满足“四三二”要求的房地产项目融资、未按约定用途使用信托贷款、信托资金挪用于缴纳土地出让金、信托产品信息披露不审慎、违规接受保险资金投资事务管理类信托计划等7项违法违规事实，被国家金融监督管理总局罚款420万元。时任陆家嘴国际信托有限公司总经理崔斌因以投资名义向不满足“四三二”要求的房地产项目融资、未按约定用途使用信托贷款、信托资金挪用于缴纳土地出让金，被国家金融监督管理总局处以警告并罚款15万元。,陆家嘴信托被罚420万元，因以投资名义向不满足要求的房地产项目融资、信托资金挪用于缴纳土地出让金等
2024-04-30 22:01:24,美联储：为期两天的FOMC货币政策会议于美东时间10:00（北京时间22:00）如期开幕。,
2024-04-30 22:00:14,美国4月谘商会消费者信心指数 97，预期 104，前值 104.7。,
2024-04-30 22:00:01,美国4月谘商会消费者现况指数 142.9，前值 151。,
2024-04-30 22:00:01,美国4月谘商会消费者预期指数 66.4，前值 73.8。,
2024-04-30 21:57:48,据法新社报道，一名以色列高级官员表示，当地时间5月1日晚，巴勒斯坦伊斯兰抵抗运动(哈马斯)将就针对加沙地带的停火提议答复以方。这名官员还称，以色列方面将在哈马斯“给出答案”后，再决定是否派遣特使前往埃及进行停火谈判。此前据以色列当地媒体报道，以色列代表团预计于4月30日前往埃及，就人质释放和停火协议进行谈判。 （中新网）,哈马斯将于5月1日答复加沙停火提议
2024-04-30 21:55:15,据上海机场集团消息，今年5月1日至5月5日的“五一”假期，上海浦东、虹桥两场预计执行航班1.1万架次（其中，浦东机场0.7万架次、虹桥机场0.4万架次），同比增长29.1%；客流量174.4万人次（其中，浦东机场109.0万人次、虹桥机场65.4万人次），日均客流量34.9万人次，同比增长40.1%。各大航空公司透露，他们新增航班，更换大机型，加密热门航线班次，以此保障市民旅客五一小长假的出行。 （澎湃）,五一小长假上海两大机场预计日均客流近35万人次，同比增四成
2024-04-30 21:52:34,Snap涨约4.5%，谷歌A涨超0.7%，Guardforce AI涨约0.5%，亚马逊、苹果至少涨超0.2%，Meta大致持平，UiPath、C3.ai、甲骨文、思科则至多跌约1%，CrowdStrike、阿里巴巴ADR、Upstart、百度ADR、戴尔科技、Bullfrog AI至多跌1.88%，特斯拉跌超2%——在4月29日收涨超15.3%之后略微回吐涨幅，Astera跌超2.4%，Reddit跌3.39%，“比特币持仓大户”微策投资MSTR跌7.29%。,人工智能概念股美股盘初多数走低，Astera跌超2%，Reddit跌超3%
2024-04-30 21:51:10,胡塞武装发言人叶海亚·萨雷亚30日说，该组织使用无人机袭击了2艘与以色列关联的商船和2艘美军驱逐舰。萨雷亚在一份视频声明中说，胡塞武装向在印度洋航行的以色列货轮“地中海猎户座”号和在红海行驶的“基克拉泽斯”号货轮发动了无人机袭击，并“准确击中目标”。但他未透露两次袭击的具体时间。（新华社）,胡塞武装称袭击2艘以色列关联商船和2艘美军舰
2024-04-30 21:47:15,艾克尔科技涨超10%，恩智浦涨5.2%，安森美涨约2.2%，Arm控股、美光科技至多涨超1.7%，超微电脑涨0.3%，AMD、台积电ADR、英伟达至多涨0.1%，Wolfspeed则跌0.5%，英特尔和阿斯麦ADR至少跌0.7%，意法半导体ADR跌超1.3%。,半导体概念股美股盘初涨跌各异，恩智浦在业绩报告发布次日涨超5%
2024-04-30 21:45:00,美国4月芝加哥PMI 37.9，预期 45，前值 41.4。,
2024-04-30 21:43:56,全球谷物油籽贸易巨头ADM：预计全球豆油及豆粕需求将增长。,
2024-04-30 21:42:08,珠海气象部门于4月30日20时40分发布全市冰雹橙色和全市雷雨大风橙色、暴雨黄色预警信号，珠海市三防指挥部、市气象灾害应急指挥部即时起启动气象灾害Ⅳ级应急响应和防汛Ⅳ级应急响应，请市民做好以下防范措施：户外人员及时到安全场所暂避，妥善安置易受冰雹影响的室外物品、车辆等。不要进入孤立的棚屋、岗亭等建筑物或大树底下，出现雷电时应当关闭手机。视灾害情况暂停户外作业。（央视）,广东珠海发布冰雹橙色预警
2024-04-30 21:38:05,中国恒大公告：由于共同及各别清盘人现正在查明公司目前事务状况，编制该公司截至2023年12月31日止年度的财务报表以及刊发2023年度业绩有所延迟。由于2023年度业绩延迟发布，现预计2023年年报亦将延迟寄发。公司股份自2024年1月29日上午10时18分起暂停买卖，并将继续停牌。,中国恒大：延迟发布2023年度业绩，继续停牌
2024-04-30 21:36:36,仅医疗业ETF上涨0.25%。而全球航空业ETF、公用事业ETF均跌超1%，银行业ETF、区域银行ETF、可选消费ETF，生物科技指数ETF及能源业ETF跌幅亦接近1%。,美股行业ETF盘初基本下跌
2024-04-30 21:32:58,道指开盘跌0.36%，标普500指数跌0.31%，纳指跌0.39%。美国一季度劳工成本指数季环比增加1.2%，创一年来最大涨幅。礼来2024年Q1营收87.68亿美元，同比增长26%，公司上调营收指引，美股开盘大涨约5%。特斯拉开盘跌3%，公司宣布两名高管将离职。亚马逊开盘跌0.15%，公司将在盘后发布财报。麦当劳开盘跌超3%，受美国市场增长放缓和巴以战争影响，公司第一季度业绩逊于预期。LME铜日内跌逾2%，矿业股受拖累走低，南方铜业开盘跌近3%，麦克莫兰铜金、纽蒙特各跌逾2%。热门中概股走势分化，蔚来涨2.6%，B站跌4%，新东方、爱奇艺各跌2.3%。,美股三大指数全线低开，礼来业绩向好开盘涨近5%
2024-04-30 21:31:36,礼来制药（LLY）上涨6.4%，至少创2月5日以来最大盘中涨幅，在一季报发布后领跑一众减肥药概念股。,
2024-04-30 21:30:38,"标普500指数低开12.39点，跌幅0.24%，报5103.78点；

道琼斯工业平均指数低开48.69点，跌幅0.13%，报38337.40点；

纳斯达克综合指数低开62.20点，跌幅0.39%，报15920.89点。",
2024-04-30 21:26:43,国家组织高值医用耗材联合采购办公室发布《人工关节集中带量采购协议期满接续采购文件》，将于2024年5月21日由企业递交申报材料，并现场开标。接续采购产品为人工关节医用耗材，产品范围与首轮集采相同，包括用于治疗原发性或继发性髋关节骨关节炎、股骨头缺血性坏死等髋关节疾病的初次置换人工全髋关节以及用于治疗膝关节各种类型关节炎等膝关节疾病的初次置换人工全膝关节。共涉及60家申报企业，全国6281家医疗机构填报人工关节采购需求达58.16万套，较首轮集采协议量增长7.42%，集采采购周期为3年，自中选结果实际执行日起计算。（央视新闻）,人工关节医用耗材接续采购5月开标
2024-04-30 21:20:01,LME锌扩大跌幅，Nyrstar宣布将于5月13日重启炼厂。,
2024-04-30 21:13:58,LME铜日内跌幅达2%，现报9958.50美元/吨。,
2024-04-30 21:12:03,斯泰兰蒂斯股价扩大跌幅，在欧洲市场下跌8.7%，触及日低。,
2024-04-30 21:09:49,巴林政府据称正在为连通该国与沙特的关键输油管道寻找投资者。（彭博）,
2024-04-30 21:07:59,市场监管总局质量强链专项项目启动会在北京召开。会议强调，各中标单位要强化责任意识，抓好组织领导、责任分工、过程管理、协同配合、资源整合，特别是要严格执行项目策划书、项目立项书、项目完工书、项目结算表“三书一表”制度，全力以赴确保各项任务目标落实落细。各相关牵头和指导单位要加强统筹协调，压实责任链条，实行挂图作战，建立专项调度机制，凝聚质量强链专项工作合力。要严格纪律要求，以高度的政治自觉和强烈的责任担当，凝心聚力、攻坚克难，共同推动质量强链工作取得重大标志性成果。（市场监管总局）,质量强链专项项目启动会在京召开
2024-04-30 21:05:34,麦当劳（MCD）在美股盘前扩大跌幅，现跌3.8%。,
2024-04-30 21:04:32,谷歌与新闻集团签订协议，以开发新低人工智能内容与产品。谷歌将向新闻集团每年支付500-600万美元。（The Information）,
2024-04-30 21:00:00,美国2月S&P/CS20座大城市房价指数同比 7.29%，预期 6.7%，前值 6.59%。,
2024-04-30 21:00:00,美国2月S&P/CS20座大城市季调后房价指数环比 0.61%，预期 0.1%，前值 0.14%。,
2024-04-30 21:00:00,美国2月FHFA房价指数环比 1.2%，预期 0.2%，前值 -0.1%。,
2024-04-30 20:58:29,衡量美国劳动力成本的一项广泛指标在第一季度加速上升，超过经济学家预期，凸显出帮助通胀维持高位的薪资压力。根据美国劳工统计局周二公布的数据，衡量包括工资和福利在内的雇佣成本指数环比增长1.2%，为一年来最大增幅，高于2023年底时的0.9%，预期为1%。,美国第一季度劳动力成本加速上升 创出一年来最大升幅
2024-04-30 20:53:31,"中共中央政治局会议：统筹研究消化存量房产和优化增量住房的政策措施。

日本周一或出手干预汇市，干预规模约为5.5万亿日元。

美国一季度劳工成本指数季环比增加1.2%，创一年来最大涨幅。

以总理：无论停火协议是否达成，以军都将进攻拉法。

礼来上调营收指引，美股盘前大涨8%。

瑞幸咖啡一季度总净收入62.781亿元，门店总数达18590家。

麦当劳一季度总营收61.69亿美元，上年同期58.98亿美元。

可口可乐一季度可比每股收益0.72美元，超预估。

百度地图：车道级地图数据全面开放合作，已完成相关车企的高级辅助驾驶验证和完全无人驾驶验证。

沪指跌0.26%，恒指收涨0.09%，日经225指数收涨1.2%。",周二美股盘前你需要了解的全球要闻
2024-04-30 20:47:31,中山出台政策措施，进一步优化房地产市场平稳健康发展。2024年5月1日起至6月30日期间（试行），凡在中山市购买新建商品住房，在缴纳契税后给予购房款5‰的电子消费券补贴（金额四舍五入至百位）。鼓励开发企业、经纪机构试点推进居民住房“以旧换新”活动，在享受第（一）条补贴的同时，2024年4月20日至12月31日期间，凡在中山市范围内出售自有住房并购买一套新建商品住房的购房人，给予每套2000元电子消费券补贴，卖旧房买新房时间不分先后。,广东中山：实施购房补贴政策 鼓励居民住房“以旧换新”
2024-04-30 20:35:46,2024年4月30日，国家金融监督管理总局与法国审慎监管与处置局召开中法金融界圆桌会。国家金融监督管理总局党委书记、局长李云泽同法国央行行长兼法国审慎监管与处置局主席弗朗索瓦·维勒鲁瓦·德加洛（François Villeroy de Galhau）出席并致辞，共同签署《关于重新签署监管合作谅解备忘录加强监管合作的意向书》。双方就近期中法金融合作成果进行了确认。李云泽局长表示近年来，中法在金融领域的务实合作不断取得新进展，两国金融监管机构保持良好监管合作关系。近期中法金融合作成果丰硕，体现了两国在金融业对外开放方面取得的积极成效。,李云泽同法国央行行长兼法国审慎监管与处置局主席德加洛共同出席中法金融界圆桌会
2024-04-30 20:34:22,标普500指数和纳斯达克100指数期货跌至盘前低点。标普500指数期货下跌0.48%，纳指期货下跌0.60%，道指期货下跌0.43%。美债收益率跃升，2年期美债收益率直接突破5%，最高至5.03%；10年期最高至4.66%。此前公布，美国一季度劳工成本指数季环比增加1.2%，创一年来最大涨幅。,雇佣成本指数超预期，美股指期下跌、美债收益率跃升
2024-04-30 20:30:04,加拿大2月GDP环比 0.2%，预期 0.3%，前值 0.6%。,
2024-04-30 20:30:04,加拿大2月GDP同比 0.8%，预期 1.1%，前值 0.9%。,
2024-04-30 20:30:02,美国一季度劳工成本指数季环比 1.2%，预期 1%，前值 0.9%。,
2024-04-30 20:25:12,近日，多家平台、微短剧小程序陆续发布公告，进一步规范微短剧小程序交易、运营管理。截至4月30日17时，已有抖音、快手、微信等平台，点众、九州、容量、花生、映宇宙、麦芽、蜜糖、掌阅、山海、古言、六翼等超10家微短剧小程序主体发布关于微短剧小程序交易、运营管理规范公告。业内人士分析，上述公告直指用户观看、购买小程序短剧中的消费陷阱，有助于促进微短剧行业健康发展，保障用户合法消费权益和良好观看体验。 (上证报),多家平台、微短剧小程序发布公告 规范微短剧交易、运营管理
2024-04-30 20:19:55,"海通证券公告，2024年4月30日，公司收到中国证监会《行政处罚决定书》。经查明，公司存在违反限制性规定转让股票的违法行为，责令改正，给予警告，对海通证券股份有限公司合计没收违法所得789,445.21元，并处以6,975,000元罚款。",海通证券：收到中国证监会行政处罚决定书
2024-04-30 20:19:01,中信证券公告，公司和孙公司中信中证资本于2024年4月12日和2024年4月19日分别收到中国证监会《立案告知书》和《行政处罚事先告知书》。2024年4月30日，公司收到中国证监会《行政处罚决定书》。,中信证券：公司和孙公司中信中证资本收到中国证监会行政处罚决定书
2024-04-30 20:18:18,比特币向下触及61000美元，日内跌超3%。,
2024-04-30 20:14:49,日元跌0.5%至盘中低点1美元兑157.13。,
2024-04-30 20:12:44,综合以色列“i24NEWS”电视台、《以色列时报》等媒体报道，当地时间4月30日下午，以色列总理内塔尼亚胡在与阵亡士兵与被扣押人员及遇难者家属进行交谈时表示，无论加沙地带停火协议是否达成，以色列都将进入加沙南部城市拉法并展开军事行动。（央视新闻）,以总理：无论停火协议是否达成，以军都将进攻拉法
2024-04-30 20:04:59,据北京市住房和城乡建设委员会，北京市发布关于优化调整本市住房限购政策的通知。自本通知印发次日起，在执行现有住房限购政策的基础上，允许居民家庭（含夫妻双方及未成年子女）或成年单身人士，在五环外新购买1套商品住房（包括新建商品住房和二手住房）。,北京市优化调整住房限购政策：2套房京籍家庭可在五环外新购一套房
2024-04-30 20:04:06,以太坊跌破3000美元，跌超6%。,
