datetime,content,title
2024-04-27 14:13:01,4月27日，北京人形机器人创新中心在北京经开区发布全球首个纯电驱拟人奔跑的全尺寸人形机器人“天工”，能以6公里/小时的速度稳定奔跑。这也是其自主研发的通用人形机器人母平台，可开放给行业使用。“天工”身高163厘米，轻量化体重达43千克；机器人配备多个视觉感知传感器，配备每秒550万亿次操作算力、高精度的惯性测量单元（IMU）和3D视觉传感器，并已解决基本运动控制问题，是具身智能场景应用和研究的最佳平台。（央视新闻）,全球首个纯电驱拟人奔跑的全尺寸人形机器人“天工”发布
2024-04-27 14:10:06,法新社：俄罗斯在领土上空击落68架乌克兰无人机。,
2024-04-27 13:48:35,根据特斯拉向内华达州就业、培训和康复部提交的一份通知，该公司计划在内华达州Sparks的工厂裁减693名员工，这是其本月早些时候宣布的全球裁员10%计划的一部分。根据特斯拉此前向德克萨斯州和加州提交的WARN通知，该公司将在加州裁员3332人，在德州裁员2688人，总计影响超过6000个职位。该公司还计划在德国工厂裁员约400人，在纽约州布法罗的太阳能工厂裁员285人。（路透）,特斯拉将在内华达州工厂裁员近700人
2024-04-27 13:27:16,据猫眼专业版数据，2024年4月27日13时02分，2024年五一档新片预售票房破9000万，《九龙城寨之围城》《维和防暴队》《间谍过家家 代号：白》分列新片预售榜前三位。,2024五一档新片预售票房破9000万
2024-04-27 13:26:13,联合国伊拉克援助团（联伊援助团）当地时间4月27日凌晨发表英文、阿拉伯语、库尔德语声明，谴责伊拉克库尔德自治区（库区）苏莱曼尼亚省豪尔穆尔气田遭袭事件。联伊援助团对袭击事件遇难者表示哀悼，对伤者和遇难者家属表达诚挚慰问，并呼吁就袭击事件展开调查，查明袭击者身份并将其绳之以法。另据伊拉克联合行动指挥部下属的安全媒体中心26日晚间声明，伊政府已成立技术调查组对豪尔穆尔气田遭袭事件展开调查。伊拉克库区政府26日发表声明说，位于苏莱曼尼亚省的豪尔穆尔气田当天遭到袭击，造成4名也门籍工作人员死亡。（央视新闻）,联合国伊拉克援助团谴责库区气田遭袭事件
2024-04-27 13:10:12,当地时间4月26日，伊拉克民兵武装“伊斯兰抵抗组织”发表声明称，该组织当天针对以色列港口城市海法的一处目标发动了无人机袭击。以色列方面对此暂无回应。（央视新闻）,伊拉克民兵武装称使用无人机袭击以色列海法
2024-04-27 13:06:23,据界面新闻，晶科能源山西基地发生火灾，向晶科能源方求证，相关人士回复称，现明火已扑灭，在做现场清理，无人员伤亡。其它具体情况尚在确认中。去年5月，晶科能源宣布，拟在山西转型综合改革示范区规划建设年产56 GW垂直一体化大基地项目，总投资约560亿元。,晶科能源山西基地发生火灾，公司回应：明火已扑灭，无人员伤亡
2024-04-27 12:52:38,受权益市场震荡、赚钱效应不佳等因素影响，作为大类资产配置工具的公募FOF，规模连续三年下台阶。截至2024年一季度末，该类基金规模为1469亿元，相比2021年规模高点萎缩超700亿元。受访机构和人士表示，将在投资端、产品端、投资需求匹配和投资者教育等方面发力，不断提升投资管理水平和投资者持有体验。尤其在养老FOF领域，将更加突出养老FOF长期投资定位，做好专业化投资和服务，为公募FOF发展打造良好的市场生态。（中国基金报）,公募FOF规模1469亿元，从高点萎缩33%
2024-04-27 12:34:01,雷军发微博称：我在车展发布会上公开“求贤招才”，诚邀天下英才加入小米汽车，一起打造梦想之车。过去48小时内，我们已收到 5000多份简历。小米汽车的目标是通过15年到20年的努力，成为全球前五的车厂。这个目标非常难，还需要非常多的人才，尤其是研发人才，我们需要最优秀、最有激情、最具韧性的工程师、设计师、产品经理等！,雷军：公开“求贤招才”，诚邀天下英才加入小米汽车
2024-04-27 12:28:56,本月，长沙持续7年的楼市限购政策终于画上句号。4月18日起，长沙已全面取消限购。新政发布一周后，某找房平台新增了2千多套二手房挂牌。从业者在等待五一有一波客流小高峰的同时，也在等待“以旧换新”更多细则出台。此外，长沙限售在本轮政策中并未放松，实际拉动效果仍待市场检验。（红星新闻）,长沙全面取消限购一周：二手房挂牌新增两千多套，中介在等五一小高峰
2024-04-27 12:06:16,4月26日，沪港合作会议第六次会议在香港特区政府总部举行。香港量子人工智能实验室与中国（上海）自由贸易试验区临港新片区管理委员会以及上海临港经济发展（集团）有限公司（“临港集团”）受邀出席会议并正式签署合作备忘录。此次合作，各方将本着优势互补、资源共享及共赢原则，在临港新片区建设“电池数字化技术平台”项目。该项目将通过联合上海市民非伏达储能数字化研究院打造沪港科创共同体，推动国际新能源数字化及新能源产业转型升级。（澎湃新闻）,沪港签署合作备忘录深化新能源数字化领域合作
2024-04-27 11:42:25,4月27日牧原股份在媒体交流活动中提及，在粮食价格高位回落背景下，公司养殖成本持续下降，2024年全年目标成本将降至14.5元/公斤，到年底预计能达到14元/公斤以下。牧原判断，目前生猪养殖行业已度过最艰难阶段，当前行业存栏母猪产能已降至绿色区间，未来一段时间行业价格将持续回暖。（证券时报）,牧原股份：行业已度过最艰难时段，公司2024年养殖成本将降至14.5元/公斤下方
2024-04-27 11:29:35,4月27日上午，在2024中关村论坛年会未来人工智能先锋论坛上，生数科技联合清华大学发布中国首个长时长、高一致性、高动态性视频大模型——Vidu。Vidu不仅能够模拟真实物理世界，还拥有丰富想象力，具备多镜头生成、时空一致性高等特点，这也是自Sora发布之后全球率先取得重大突破的视频大模型，性能全面对标国际顶尖水平，并在加速迭代提升中。（北京日报）,中国首个Sora级视频大模型发布
2024-04-27 11:16:03,深圳市气象台于今日（27日）11时发布全市雷电预警信号，预计2小时内全市将受雷电影响。此外，目前珠江口以西有雷雨云团生成并逐渐东移，稍后深圳将自西向东渐转雷阵雨，最大小时雨强10毫米左右，最大阵风6级左右；今天下午天气仍不稳定，有阵雨或雷阵雨；夜间南风再次加强，暴雨风险加大。（大湾区之声）,深圳全市雷电预警
2024-04-27 11:10:26,日本首相岸田文雄：将推动工会政策以提高工资。,
2024-04-27 11:09:24,全美汽车工人联合会（UAW）与戴姆勒卡车（Daimler Truck）达成初步协议。,
2024-04-27 10:45:37,宝马宣布，将深化在华布局，计划对沈阳生产基地增加投资200亿元人民币。此项投资的重点聚焦于宝马在华生产的发源地——大东工厂的大规模升级和技术创新，为2026年启动宝马“新世代”车型的本土化生产奠定坚实基础。据悉，随着宝马的进一步投资，沈阳生产基地将继续在智能制造和绿色生产等方面树立全新的行业标杆。（中新网）,宝马在辽投资增加200亿元，沈阳生产基地将大规模升级
2024-04-27 10:38:51,据台湾《经济日报》，联发科执行长蔡力行表示，联发科今年各产品类别营收都将较前一年度增长，手机营收增长更高于其他类别。因为在旗舰手机市场的强劲市占率扩张，加上旗舰手机芯片平均单价较高，全年手机营收增长有信心高于中十位数百分比，旗舰手机芯片营收可望增长超过50%。蔡力行指出，第一季超越营运目标范围高标，主要来自手机、宽带与电视客户库存回补需求优于预期。,联发科执行长蔡力行：今年旗舰手机芯片营收有望增长超过50%
2024-04-27 10:35:56,在4月27日举办的2024第八届中国科幻大会上，《2024中国科幻产业报告》正式发布，2023年中国科幻产业总营收达1132.9亿元，同比增长29.1%，这是中国科幻产业总营收首次突破千亿元大关。（新华社）,2023年中国科幻产业总营收首破千亿元
2024-04-27 10:32:43,从国家航天局获悉，4月27日，嫦娥六号探测器和长征五号遥八运载火箭在中国文昌航天发射场完成技术区相关工作后，器箭组合体垂直转运至发射区，计划5月初择机实施发射。 (央视新闻),5月初奔月！嫦娥六号完成垂直转运
2024-04-27 10:06:56,据小米汽车微博，5月1日至31日，下定全系享受： ①赠送价值8000元全粒面Nappa真皮座椅； ②小米智能驾驶增强智驾功能终身免费。 首销期权益4月30日24点截止，以支付时间为准。,小米汽车推出小米SU7 5月限时购车权益
2024-04-27 10:05:48,携程最新发布的数据显示，今年一季度，国内入境游订单同比增长超3倍。免签政策对入境游的拉动效应明显。去年12月1日起，中国正式对法国、德国、意大利、荷兰、西班牙、马来西亚等国家试行单方面免签。一季度，上述六国入境中国游客合计同比增长约6倍，其中马来西亚增速最高，约9倍。（证券时报）,携程：一季度入境游订单同比增长超3倍，免签国家增速明显
2024-04-27 09:51:34,据新华社，据乌克兰媒体和军方发布的消息，26日深夜至27日凌晨，俄罗斯对乌克兰发动新一轮导弹袭击，文尼察州和伊万诺-弗兰科夫斯克州相继传出爆炸声。,乌克兰称俄方发动新一轮导弹袭击
2024-04-27 09:48:11,据北京发布公众号，北京市委书记尹力围绕“充分发挥首都优势，推动会展业高质量发展”到顺义区调查研究。尹力在调研时指出，顺义区是现代制造业大区，具有坚实的产业基础和发展优势，要推动高端制造业挑大梁。持续深化创新产业集群示范区建设，完善与“三城”对接机制，推动更多科技成果转化。汽车产业发挥头部企业带动作用，吸引更多核心零部件项目落地，推动汽车制造、汽车展览、工业旅游融合发展。,北京市委书记尹力：顺义区要推动高端制造业挑大梁
2024-04-27 09:39:15,据国家统计局，1—3月份，计算机、通信和其他电子设备制造业利润增长82.5%，有色金属冶炼和压延加工业增长57.2%，电力、热力生产和供应业增长47.5%，汽车制造业增长32.0%，纺织业增长25.0%，通用设备制造业增长7.9%，石油和天然气开采业增长3.8%，农副食品加工业增长2.0%，化学原料和化学制品制造业下降3.5%，电气机械和器材制造业下降6.9%，专用设备制造业下降7.2%，煤炭开采和洗选业下降33.5%，非金属矿物制品业下降54.2%，石油煤炭及其他燃料加工业由盈转亏，黑色金属冶炼和压延加工业亏损增加。,国家统计局：1—3月份计算机、通信和其他电子设备制造业利润增长82.5%
2024-04-27 09:36:35,一季度，全国规模以上工业企业利润同比增长4.3%，由上年全年下降2.3%转为正增长。分季度看，规上工业企业利润连续三个季度增长，延续恢复态势。近七成行业利润实现增长。一季度，在41个工业大类行业中，有28个行业利润同比增长，占68.3%，比上年全年扩大2.4个百分点。分门类看，制造业利润由上年全年下降2.0%转为增长7.9%；采矿业利润下降18.5%，降幅比上年全年收窄1.2个百分点；电力热力燃气及水生产和供应业利润增长40.0%，保持快速增长态势。,国家统计局：一季度规模以上工业企业利润持续增长
2024-04-27 09:32:36,中国3月规模以上工业企业利润同比 -3.5%。,
2024-04-27 09:31:45,国家统计局：1—3月份，全国规模以上工业企业实现利润总额15055.3亿元，同比增长4.3%。1—3月份，规模以上工业企业中，国有控股企业实现利润总额5738.2亿元，同比下降2.6%；股份制企业实现利润总额11203.0亿元，增长0.8%；外商及港澳台投资企业实现利润总额3737.5亿元，增长18.1%；私营企业实现利润总额3679.7亿元，增长5.8%。,国家统计局：2024年1—3月份全国规模以上工业企业利润增长4.3%
2024-04-27 09:20:45,据“香港特区政府驻沪办”微信公众号，4月25日，沪港合作会议第六次会议在港举行。消息提到，邹劲松以中央港澳工作办公室、国务院港澳事务办公室三局局长的身份出席活动。,邹劲松已任中央港澳工作办公室、国务院港澳事务办公室三局局长
2024-04-27 09:13:18,国家林草局今天（4月27日）发布，日前，中国野生动物保护协会与美国圣迭戈动物园签署了大熊猫保护合作协议，将选择一对大熊猫前往美国圣迭戈动物园，开启为期10年的大熊猫国际保护合作。中方从中国大熊猫保护研究中心选定了一对大熊猫“云川”（雄性）、“鑫宝”（雌性），并为两只大熊猫安排了经验丰富的饲养师和兽医陪同赴美。（央视新闻）,大熊猫“云川”和“鑫宝”将赴美，期限10年
2024-04-27 09:07:41,美军当地时间4月26日表示，也门胡塞武装向红海发射了三枚反舰弹道导弹，对一艘英国油轮Andromeda Star造成轻微损害。当地时间27日凌晨，也门胡塞武装发言人叶海亚·萨雷亚发表声明称，胡塞武装26日使用数枚导弹袭击了位于红海的英国油轮Andromeda Star，并成功击中目标。（央视新闻）,美军证实一艘英国油轮在红海遭胡塞武装袭击受损
2024-04-27 08:59:11,据澎湃新闻，根据全国人民代表大会常务委员会代表资格审查委员会早前报告，由西藏自治区选出的第十四届全国人民代表大会代表，十四届全国人大民族委员会委员，中国医药集团有限公司原总工程师、首席科学家杨晓明，因涉嫌严重违纪违法，2024年3月29日，西藏自治区第十二届人大常委会第九次会议决定罢免杨晓明的第十四届全国人民代表大会代表职务。,国药集团原总工程师杨晓明涉嫌严重违纪违法
2024-04-27 08:54:33,据央视新闻，当地时间4月27日，乌克兰首都基辅拉响防空警报。,
2024-04-27 08:52:47,美国SEC文件显示，伯克希尔哈撒韦增持500000股Liberty SiriusXM A类股票，增持647016股Liberty SiriusXM C类股票。,伯克希尔哈撒韦继续增持Liberty SiriusXM
2024-04-27 08:44:53,比特币跌破63000美元/枚，日内跌1.5%。,
2024-04-27 08:15:48,据证券日报，数据显示，截至4月26日，已有38家基金管理人披露旗下宽基ETF（交易型开放式指数基金）一季报，211只宽基ETF资产规模合计净值1.21万亿元，较去年同期增长超2倍，其中78只较去年同期实现增长，华泰柏瑞沪深300ETF等10只头部产品规模增超百亿元，还有17只规模同比增超10亿元。,资金持续涌入，211只宽基ETF一季度总规模同比增长超2倍
2024-04-27 08:10:34,美国中央司令部4月26日发表声明称，美军于25日在也门胡塞武装控制区摧毁了一艘无人水面艇和一架无人机。此外，25日当天有一枚反舰导弹从胡塞武装控制区射向亚丁湾，但没有对美军等船只造成损失。（央视新闻）,美军对也门胡塞武装目标发动打击
2024-04-27 08:03:30,据海报新闻，近日，不少网友发帖称，最近自己所在城市的刮刮乐“一票难求”，即开型彩票缺货情况较为严重。此前网上有传言称国家正在管控即开型彩票的发售情况，记者向中国体彩和中国福彩进行求证，双方均表示目前没有收到管控通知，缺货是因为供不应求。,多家彩票店“刮刮乐”售空，福彩体彩：供不应求，没有管控通知
2024-04-27 08:02:28,据央视新闻，以色列媒体报道，当地时间26日下午，以色列官员与埃及代表团在以色列特拉维夫举行会谈，会谈内容围绕以色列与哈马斯就被扣押人员交换和加沙地带停火的协议，以及以色列即将在拉法发动的地面攻势展开。埃及消息人士表示，同以色列的谈判进展显著。一名以色列官员表示，以方已准备好在进攻拉法之前，给巴以双方达成协议“最后一次机会”。,以官员称进攻拉法前给巴以和谈“最后一次机会”
2024-04-27 07:50:19,财险公司2023年业绩陆续出炉。据记者梳理，截至4月26日，已有12家财险公司发布了2023年年报。其中9家盈利，合计净利润451.8亿元；3家亏损，亏损总额为3.24亿元。12家险企去年合计净利润为448.56亿元，同比减少8.7%。财险“老三家”（人保财险、平安产险、太保产险）合计净利润为407.62亿元，同比下降14%。此外，备受市场关注的是，去年有11家险企综合成本率较上年有所上升。（证券日报）,财险“老三家”去年净利合计超400亿元，行业整体综合成本率走高
2024-04-27 07:40:17,特斯拉美国将Model 3高性能版本价格从52990美元上调至53990美元。,
2024-04-27 07:39:33,"Snap收涨27.63%，报14.55美元，逼近2月6日收盘位17.45美元——意味着2月7日暴跌34.61%所形成的缺口收复大概一半。

Astera收涨18.73%，逼平3月25日所创收盘历史最高位85.00美元，逼近3月26日所创（3月20日美国IPO以来）盘中历史最高位95.21美元，本周累涨31.80%——仅次于IPO当周94.44的累计涨幅。

谷歌A收涨10.22%，报171.95美元，突破4月11日所创收盘历史最高位159.41美元，收盘市值2.13万亿美元，本周累涨11.59%，突破2023年5月12日11.31%的周涨幅、逼近3月17日12.13%的累计涨幅和2021年2月5日14.32%的周涨幅。

英伟达收涨6.18%，本周累涨15.14%，逼近2023年5月26日当周24.57%的累计涨幅。

“英伟达概念股”SoundHound收涨5.77%，本周累涨23.94%，此前五周先后跌31.09%、4.07%、12.05%、15.44%、18.95%。

BigBear.ai涨超8.4%，本周累涨24.14%，逼近3月1日当周77.44%的累计涨幅；Reddit收涨7.02%，逼近4月2日9.75%、3月25日30%的单日涨幅、3月21日美国IPO首日48.35%，本周累涨11.13%，创历史上最大单周涨幅。

C3.ai收涨3.02%，本周累涨10.18%，结束此前连续七周下跌的趋势。

Guardforce AI收涨超6.3%，苹果则收跌超0.3%，IBM和特斯拉跌超1%，英特尔跌9.2%——本周累跌6.78%此前三周先后跌12.36%、7.8%、4.17%。",人工智能概念股多数收涨，Snap涨超27%，谷歌A涨超10%，SoundHound本周累涨将近24%
2024-04-27 07:35:35,当地时间26日，黎巴嫩国家通讯社报道称，以色列国防军当天对黎以临时边界黎方一侧的多个城镇发动了多次袭击。其中，一辆汽车在临时边界黎方一侧遭到以军无人机袭击，造成两人死亡。同一天，以色列国防军发表声明称，以黎临时边界以方一侧的多个地区25日夜间以来遭到来自黎方一侧的火箭弹和导弹袭击，有一人在导弹袭击中死亡。（央视新闻）,黎以临时边界交火不断，多人死亡
2024-04-27 07:18:24,外交部北美大洋洲司司长杨涛26日晚就美国国务卿布林肯访华向媒体吹风。（新华社）,
2024-04-27 07:13:38,据美国广播公司（ABC）报道，当地时间4月26日，美国达美航空一架从纽约肯尼迪国际机场飞往洛杉矶的波音767客机在起飞后右翼应急滑梯脱落，该飞机被迫返回肯尼迪国际机场并紧急降落。美国联邦航空管理局在一份声明中表示，机组人员在飞机起飞后发现右翼紧急出口的滑梯震动异常，在经过检查后发现滑梯已与飞机分离，机组人员随后呼叫空中交通管制并宣布紧急降落。,美国达美航空一波音客机应急滑梯在飞行过程中脱落
2024-04-27 07:11:09,昨天（26日）11时18分，一列满载农产品货物的中欧班列从乌鲁木齐三坪集装箱中心站开出，经霍尔果斯铁路口岸出境，将途经中亚多个国家，跨越里海、黑海、地中海，抵达意大利萨莱诺，全程运行约1万公里。这趟班列从中国新疆霍尔果斯铁路口岸出境，穿过哈萨克斯坦境内，从阿克套港入里海，通过海运自阿塞拜疆的巴库港上岸，再通过火车途经阿塞拜疆、格鲁吉亚境内，从格鲁吉亚波季港入黑海装上货轮，通过土耳其海峡到地中海，最后到达意大利的萨莱诺。（央视）,中欧班列再+1，全程运输时间比海运节省一半以上
2024-04-27 07:06:36,"英伟达两倍做多ETF收涨12.21%，本周累计上涨30.62%——此前四周先后跌8.77%、5.47%、0.03%、26.64%。

英伟达收涨6.18%，本周累计上涨15.14%，此前四周先后跌4.17%、跌2.6%、涨0.2%、跌15.39%。

超微电脑收涨8.9%，本周累涨20.15%——仍然处于“3月8日涨至1229.00美元创盘中历史新高以来”的周线回调趋势之中。

美光科技涨超2.9%，本周累涨7.56%，在上周跌12.86%之后收复部分失地。

英特尔收跌9.2%，本周累跌6.78%，延续此前三周先后跌12.36%、7.8%、4.17%的趋势。

纳微半导体周五收涨7.73%，Wolfspeed涨5.55%，ASM国际ADR涨超4.8%，博通涨超3.8%，迈威尔科技涨约3.2%，应用材料涨约3%，阿斯麦ADR涨超2%，微芯科技、高通、凌云半导体、思佳讯、德州仪器至多涨超1.5%，苹果则跌超0.3%，希捷科技跌1.4%，意法半导体ADR跌2.98%。",半导体概念股周五普遍收涨，英伟达涨超6%，超微电脑涨约9%，英特尔则跌超9%
2024-04-27 07:04:40,高盛首席美国股票策略师David Kostin表示，如果利率继续大幅走高，无论其上升的原因是什么，美股恐将陷入困境。Kostin认为，自2006年以来，在实际收益率一个月内上升超过2个标准差的情况下，标普500指数平均下跌4%。如果美联储在今年晚些时候降息，且对资本成本的担忧消退，那么相较于价值股，优质股（例如资本回报率较高的股票）可能会受到打击。,高盛：如果利率继续走高，美股可能陷入困境
2024-04-27 06:30:17,据知情人士透露，苹果重新加强与OpenAI磋商，以便在今年发布的iPhone中增添一些AI功能。苹果希望，将OpenAI的功能加入iOS 18。双方已经开始讨论一份潜在合作协议的条款，和如何将OpenAI的那些功能整合到iOS 18。苹果还在与Alphabet旗下谷歌接触，希望能获得谷歌大模型Gemini聊天机器人的授权许可。讨论侧重于在iOS 18支持AI聊天机器人。苹果尚未决定选用哪家的聊天机器人，可能会同时与两家公司达成协议、另外找一家完全不同的合作方。（彭博）,报道：苹果重启与OpenAI的谈判，考虑在iOS 18增添AI聊天机器人
2024-04-27 06:24:57,"美国宾州区域金融服务控股公司Fulton Financial Corp.（FULT）美股盘后短线拉升，涨幅扩大至将近2.4%，该公司将收购费城Republic First Bank（第一共和银行）的资产。

美国联邦存款保险公司（FDIC）称，Republic First Bank成为美国在2024年第一家倒闭的银行；至1月31日，Republic First Bank拥有60亿美元资产和40亿美元存款；与该公司倒闭相关的存款保险基金（DIF）成本估计为6.67亿美元。

费城Republic First Bank在新泽西州、宾夕法尼亚州、纽约州的32家分支将于周六（4月27日）或下周一正常的营业时间段以Fulton Bank分行的方式恢复营业。",美国金融监管部门：美国2024年出现第一家倒闭的银行
2024-04-27 06:10:55,日本将于下周一（4月29日）起迎来多日假期，日本金融市场将于4月29日、5月3日与5月6日休市。下周其他时段交投水平亦将缩减，不排除出现短时剧烈波动行情。,提醒：日本下周将迎来“黄金周”
2024-04-27 05:59:12,低空经济的发展，为物流快递打开了新的增长空间。今年3月，中通快递与峰飞航空签订V2000CG大型eVTOL航空器购机协议，订单量为30架。据悉，顺丰控股旗下丰翼在小型物流无人机领域探索超10年，积累了丰富的自研技术基础。公司此前在投资者交流会上表示，丰翼小型物流无人机发展分为三阶段：飞起来、飞得多、飞得好，目前处于第二阶段。截至2023年，丰翼小型物流无人机在全国累计飞行400余万公里，全国运输架次已突破80万，是小型物流无人机领域商业化规模最大的玩家。（上证报）,全球布局 “低空”起飞，快递龙头构建第二增长曲线
