datetime,content,title
2024-04-29 09:05:16,中国物流与采购联合会今天（29日）公布今年一季度物流运行数据。一季度，物流运行总体延续恢复态势，社会物流总额增速稳中有升，物流需求恢复向好，运行稳定性明显增强。一季度，全国社会物流总额为88万亿元，同比增长5.9%，增速比上年四季度加快0.5个百分点，比上年同期加快2个百分点。社会物流总额延续上年以来的回升向好态势，总体恢复水平稳中有升。从社会物流总额结构看，工业品物流总额占社会物流总额比重接近九成，物流支撑生产领域的作用依然强劲。（央视新闻）,实现良好开局！一季度社会物流总额同比增长5.9%
2024-04-29 09:04:37,现货黄金短线下挫，跌破2330美元/盎司，现报2328美元/盎司，日内跌超0.3%。,
2024-04-29 09:01:02,富时中国A50指数期货盘初跌0.1%，上一交易日夜盘收跌0.07％。,
2024-04-29 09:00:56,"中国台湾证交所加权股价指数开高0.6%报20,235.93点。",
2024-04-29 08:57:58,据证券时报，去年四季度末，金汇荣盛和瑞丰汇邦分别持有贵州茅台792万股、675万股，期末持股市值分别为136.74亿元、116.52亿元。不过，今年一季度末，这两家私募选择了抛售，双双退出贵州茅台的十大流通股东名单，甚至不排除已经清仓。上述两大私募持仓贵州茅台长达5年，如今在该股持续高位震荡中选择了离场。此前，有投资者怀疑这两大“神秘”私募背后的持有人为段永平，而段永平曾在社交平台上回应“没有卖出贵州茅台”。,两大神秘私募清仓茅台？业界大佬最新持仓曝光
2024-04-29 08:55:43,截至4月26日，上交所融资余额报7838.67亿元，较前一交易日减少6.92亿元；深交所融资余额报6969.15亿元，较前一交易日减少27.19亿元；两市合计14807.82亿元，较前一交易日减少34.11亿元。,两市融资余额减少34.11亿元
2024-04-29 08:52:02,文章称，城市规模越大，治理面对的问题越复杂。坚持走内涵式发展路子，秉承“稳中有进”的理念，加强韧性安全城市建设，积极实施城市更新行动，实现城市高质量发展和高水平安全良性互动，方能使超大城市更加宜业、宜居、宜乐、宜游。,人民日报：积极探索超大城市现代化治理新路子
2024-04-29 08:46:24,据中国驻美国大使馆，4月27日，中国驻美国大使馆举办“平安美国行”领保宣传活动，发布《平安美国行》预防性领保宣传折页和动漫视频。谢锋大使出席并致辞。谢锋说，3年来，近300名中国公民遭到美方无端滋扰遣返，其中持有合法有效材料的留学生超过70人，就连应美方邀请来美友好访问的中国公务人员也被无端滋扰盘查。针对美方选择性、歧视性、政治性执法，我们感同身受、据理力争，向美国国务院、白宫国安会、国土安全部及海关与边境保护局等多个部门提出严正交涉，“发生一起、交涉一起”，促美尽快移除阻碍人文交流的“绊脚石”。面对美将超过1500家中国企业列入制裁清单，还将“战火”延烧到电动汽车、数据流动、港口设备、社交媒体等领域，使馆持续敦促美方停止对华经贸科技打压，要求将拜登总统不寻求打压遏制中国发展的表态落到实处。,中国驻美大使谢锋： 使馆坚决维护旅美同胞正当合法权益
2024-04-29 08:44:59,中国10年期国债现券活跃券240004收益率上涨1.7BP至2.34%。,
2024-04-29 08:41:15,近日，记者在采访中发现，深圳南山区有新房项目推出“买房送黄金”活动，根据不同户型的特惠房源赠送888克和1388克黄金，市值达到近50万元和80万元。“最近黄金市场火热，开发商真会‘抓热点’，通过这样的方式来变相打折。”有购房者如是说。记者也随机采访了几位购房者，大家均表示感觉很新鲜，但对于促销的真实性存疑，到底是噱头还是真优惠，有时候难以辨别。市场就曾传出消息，由于金价上涨，开发商承诺赠送的黄金却未能按时兑现。（证券时报）,深圳南山区有新房项目买房送80万元黄金？
2024-04-29 08:39:36,知情人士称，争取成为相关流通量提供者计划的机构，早前已进行用户验收测试，港交所正筹备推出国债期货的工作，并将向香港证监会提交产品许可呈请。倘下月内能获监管当局批准，产品最快可于7月份前后或第三季内登场，不过最终安排仍不排除有变，以公告为准。 (香港信报),港交所或于第三季推出中国国债期货合约
2024-04-29 08:39:12,中国外汇交易中心（CFETS）：4月26日人民币汇率指数按周跌0.33至100.40。,
2024-04-29 08:32:55,英伟达CEO黄仁勋认为，人工智能将改变世界，但人类的工作并不会因此消失。在当地时间周日晚播出的一次采访中，黄仁勋说，随着人工智能帮助企业，它们自然会扩张。“工人们为公司工作，因此，当公司变得更有效率时，盈利就会增长。我从来没有见过一家公司盈利增长而不招更多的人。”他说，即使有些工作被淘汰了，“我相信你仍然希望人类参与其中，因为我们有很好的判断力，因为有些情况机器是无法理解的。”黄仁勋说，当谈到人工智能的能力时，天空才是极限。“我们希望它能给我们带来惊喜。这才是重点。在某些领域，比如药物发现，设计更轻、更强的更好的材料。我们需要AI来帮助我们在我们自己无法做到的地方探索宇宙。”,黄仁勋最新访谈：AI不会完全取代人类工作
2024-04-29 08:22:54,美国国务卿布林肯将在当地时间上午10点在利雅得与海合会外长会面，于上午11:15与沙特外长会面，于下午1:30与土耳其外长会面。,
2024-04-29 08:22:07,4月29日盘前，旭辉控股就境外流动资金状况全面解决方案及业务发展的最新情况发布公告，宣布已与债券持有人小组就全面方案原则上达成一致，债券持有人小组的持有人合共持有或控制旭辉优先票据、永续债及可转股债券本金总额约43%。旭辉的“全面提案”共包括6个选项，选项包含了本金削减、债转股及发行新债券/贷款，目标削减约33亿至40亿美元的境外债务。公告对这一进展表述为“对本公司落实该提案而言是一项重大里程碑。,旭辉：已与占比43%的债券持有人小组就方案原则上达成一致
2024-04-29 08:12:35,澳大利亚S&P/ASX200指数开盘上涨0.74%，报7632点。,
2024-04-29 08:02:29,中集车辆港交所公告，本公司于美国时间2024年4月25日，收到美国海关与边境保护局（CBP）关于本次EAPA调查结果的通知。根据本次EAPA调查的现场验证情况和全部记录材料，CBP认定没有实质性证据表明全资子公司CIE逃避美国的反倾销税及反补贴税，即认定CIE不存在将包含来自中国的骨架车和╱或其组件的商品进口到美国市场的情形；且CBP认定没有实质性证据表明DS工厂存在将原产于中国的骨架车和骨架车组件通过泰国转运并出口到美国的规避行为。,中集车辆：没有实质性证据表明子公司逃避美国的反倾销税及反补贴税
2024-04-29 08:01:28,"韩国首尔综指开盘上涨0.7%。

今日日股休市。",
2024-04-29 07:58:48,亿纬锂能4月26日在业绩说明会上表示，2024年公司对储能出货量规划目标在50GWh以上；公司希望储能系统2024年在储能电池的出货占比超过15%。此外，公司认为，国内外大储市场有望继续保持高速增长，预计全年将保持30%—50%增速。（证券时报）,亿纬锂能：预计国内外大储市场全年将保持30%—50%增速
2024-04-29 07:57:16,华夏比特币ETF和华夏以太币ETF已获得香港证券及期货事务监察委员会（SFC）的批准，拟定于4月29日发行， 4月30日在香港交易所上市。这是亚洲市场上首次推出此类产品，这两只产品旨在提供紧贴比特币和以太币现货价格的投资回报。香港的现货加密货币ETF相较于实物加密货币，其受监管机构认可，在传统交易所上市，由专业基金公司管理，合作的加密货币交易所受监管等特点，和全球首创的实物申赎机制，有望吸引将实物加密货币转换为ETF产品的加密资产投资者。（每经）,亚洲首批，华夏比特币ETF和华夏以太币ETF今日发行
2024-04-29 07:56:22,据美的集团消息，4月28日下午，美的集团董事长兼总裁方洪波一行拜访伊利集团，与伊利集团董事长兼总裁潘刚等进行了会谈。双方已在机器人与自动化、暖通设备及系统、数字化、物流、冰柜等领域展开了深度的合作，本次到访，双方的全面战略合作关系得到进一步深化发展。,美的集团方洪波一行拜访伊利集团
2024-04-29 07:49:29,传统定价框架下，黄金兼具货币、商品和金融三重属性，对应货币、抗通胀和避险价值，因此通常与美元、美债利率反向变动。但近期这一定价规律“失灵”了，黄金、利率和美元同涨。三者同涨后，一个月后续转为下跌的频率超过一半，且两个月内往往回吐前期涨幅。往前看，我们认为黄金短期透支，但降息交易未结束，中枢在2400~2500美元/盎司；长逻辑可作为机会成本低时加配依据，包括局部去美元化需求等。是否正在经历第三次全球货币体系寻锚将对包括黄金在内的资产定价产生重大影响。,中金公司：黄金短期透支，但降息交易未结束
2024-04-29 07:48:30,"美国PCE数据相对温和，担忧暂缓，纳指上周五涨2%创两个月最大涨幅，全周涨超4%，和标普共创五个月最大周涨幅。

财报后谷歌飙涨10%，创历史新高及九年最大涨幅，微软收涨近2%。特斯拉跌超1%，财报周仍涨逾14%。

习近平会见美国国务卿：中美双方应该彼此成就，而不是互相伤害。据外交部，中美达成五点共识。

商务部、财政部等七部门联合印发《汽车以旧换新补贴实施细则》；四部门：做好金融支持大规模设备更新和消费品以旧换新工作。

中国一季度规模以上工业利润同比增长4.3%，由去年全年下降2.3%转为正增长。

生数科技联合清华发布中国首个Sora级视频大模型Vidu；中国发布全球首个纯电驱拟人奔跑的全尺寸人形机器人“天工”。

李强在车展调研时强调大力发展智能网联新能源汽车；李强会见周日访华的马斯克，称特斯拉堪称中美经贸合作的成功范例；特斯拉成为首家通过中国汽车数据安全要求的外企，各地已陆续解除智能网联汽车禁停禁行；特斯拉称将继续深耕中国，加速清洁能源与自动驾驶技术落地。

美国3月核心PCE物价同比增至2.82%，略超预期，支出同比增速创一年新高。PCE数据相对温和，市场押注美联储9月降息的概率由60%升至65%。

日本央行“按兵不动”，删除“购买与之前相同数量债券”的措辞；日央行行长：外汇或是影响通胀的重要因素，购债立场没有变化；日元暴跌破158关口。

伦铜两年来首次盘中突破1万美元大关，此后报道称英美资源拒绝必和必拓的收购提案。

苹果据称重新加强与OpenAI磋商，iOS 18或添加GPT机器人；马斯克称特斯拉今年AI训练和推理将投入100亿美元。",华尔街见闻早餐| 2024年4月29日
2024-04-29 07:45:02,据星期日泰晤士报报道，苏格兰首席部长胡穆扎·优素福正准备周一辞职，因为他认为没有办法通过议会信任投票。优素福周末对苏格兰民族党高级成员作此表示。报道称，John Swinney已获接洽，在优素福离职的情况下担任临时首席部长。,报道：苏格兰首席部长优素福准备辞职
2024-04-29 07:40:02,在债牛带动下，以中短债基金为代表的纯债产品受投资者热捧，一季度疯狂“吸金”。Wind数据显示，在所有已发布一季报的中短债基金中，有28只基金的规模在一季度实现了翻倍增长，甚至不乏迷你基金突变成大型产品的案例。颇为典型的是，一度濒临清盘的迷你基金——汇添富丰润中短债，去年末规模仅有0.61亿元，但到了今年一季度末，该基金的规模则暴增至79.94亿元，单季“吸金”约79.32亿元，增幅达12900%。（证券时报）,中短债基疯狂“吸金” ，汇添富丰润单季规模暴增129倍
2024-04-29 07:37:16,据大河财立方，中牟县自然资源和规划局、郑州市自然资源和规划局经开分局公告称，决定以挂牌方式出让郑政经开出〔2024〕8号地块的国有建设用地使用权。该地块位于经开第三十八大街以西、经南十八路以南、郑民高速辅道以北，使用权面积145758.63平方米（折合约218.64亩），土地用途地上为工业用地（标准地），地下空间为交通服务场站用地，起始价8588万元，固定资产投资不低于130800万元。,起始价8588万元，郑州218.64亩工业用地挂牌出让
2024-04-29 07:34:00,近些年，私募基金份额持有人大会面临困境，屡屡出现各类纠纷。为了解决这些问题，去年以来，部分私募基金找到具有公信力的公证机关，请他们介入，以解决私募持有人大会在召集、表决等方面存在的合规问题。（上证报）,积极引入公证机构，私募破解持有人大会合规困境
2024-04-29 07:22:43,美国明尼苏达大学双城分校研究人员构建出一种机器人，通过机器学习培训，该机器人能自动完成基因研究中复杂的显微注射，使进行大规模基因实验更加轻松。这项技术不仅可用于基因实验，还可通过冷冻保存技术来帮助保护濒危物种。相关论文刊发于最新一期《遗传学》杂志。（科技日报）,机器人实现全自动显微注射
2024-04-29 07:20:27,随着A股上市公司2023年年报以及今年一季报披露接近尾声，险资作为长期资金的代表，重仓了银行板块、通信板块等高股息权益资产。就近两个季度新进股票来看，化工、有色金属、煤炭等资源板块也受到了险资青睐。对于A股今年走势，险资大多持谨慎乐观态度，同时表示看好低估值、高股息股票。,证券日报：险资过去两个季度重仓高息股及资源股
2024-04-29 07:11:47,据金科股份官微，4月27日，金科股份司法重整专项推进会在重庆市人民政府会议室2102召开，重庆市人民政府、市高院、市委金融办、市住建委、两江新区管委会、长城资产以及金科股份多方代表参会。会议上，市委、市政府高度肯定金科持续自救取得的良好成效；高度肯定金科具有良好的重整投资价值和充分的前期准备工作。要求长城与金科加速推进正式投资协议的签订；要求工作专班要应作尽作、能作必作，进一步加大对金科的帮扶工作力度，全力支持金科重整成功，把金科重整打造为行业风险化解范例。金科股份实控人表示，将会想尽办法筹措资金，竭尽全力加大增持力度，全力维护上市公司主体地位；竭尽全力支持金科司法重整和战投引进，坚信金科司法重整最终必定取得成功。,重庆市政府、市高院召开专项会议，全力支持金科重整成功
2024-04-29 07:07:26,据巴勒斯坦通讯社当地时间4月29日凌晨报道，以军28日夜间密集轰炸加沙地带南部城市拉法，造成至少15人死亡。（新华社）,以军轰炸加沙地带南部城市拉法，至少15人死亡
2024-04-29 07:04:10,对于以色列近日提出的最新停火方案，巴勒斯坦伊斯兰抵抗运动（哈马斯）高级官员萨米·祖赫里当地时间4月28日称，除非以军停止在加沙地带的战争，否则哈马斯不会接受任何与以色列的协议。萨米·祖赫里在一份声明中补充说，哈马斯正在研究以色列的停火提案，现在就做出决定还为时过早。 (央视新闻),哈马斯官员：不会与以色列达成不包含加沙停战的协议
2024-04-29 07:00:39,据英国《每日电讯报》27日报道，英国计划在2030年前列装国产高超音速巡航导弹。该计划已被首相苏纳克包含在未来6年拟增加的750亿英镑国防预算内。英国研制高超音速导弹的计划仍处于早期阶段，目前尚未决定是从陆地、海上还是空中发射。但消息人士向该报表示，如果需要更快地获得这种武器，英国可能会从美国购买高超音速导弹。 (环球时报),英国计划在2030年前列装国产高超音速巡航导弹
2024-04-29 06:58:17,据今日俄罗斯电视台4月28日报道，俄罗斯圣彼得堡一家法院日前下令冻结美国摩根大通银行在俄罗斯的资产。据报道，此举源于俄罗斯联邦外贸银行向俄法院发起的诉讼，旨在追回该银行因美国制裁而被冻结在海外的近4.4亿美元资金。目前俄罗斯法院已下令查封摩根大通的在俄资产，及其俄罗斯子公司的股份。 (央视新闻),俄罗斯法院冻结美国摩根大通银行在俄资产
2024-04-29 06:47:34,在中基协最新披露的公募基金销售保有规模百强名单中，银行渠道的市占率连续12个季度下滑。近年来，券商渠道凭借ETF业务逆势增长，互联网平台则依靠流量优势迅速崛起，使得银行渠道在基金代销业务上备感“危机重重”。据此，各大银行也从降低申购费、布局C份额等维度卖力“促销”，吸引对费率敏感的基金投资者。（证券时报）,市占率连续12季下滑，多家银行打折卖基金
2024-04-29 06:45:03,当前，券商资管业务加速转型、回归主动管理本源，通道业务则逐步出清。截至今年一季度末，券商私募资管产品存量规模企稳回升至5.35万亿元，以主动管理为代表的集合资产管理计划规模占比提升至50.18%。在公募、私募资管业务协同发展的趋势下，从已披露今年一季报的上市券商资管业务业绩表现来看，今年一季度有4家公司资管业务净收入均同比增长超100%。 (证券日报),一季度券商私募资管规模回升至5.35万亿元
2024-04-29 06:43:46,随着年报披露接近尾声，A股公司分红计划陆续浮出水面。Wind数据显示，截至4月28日记者发稿，已有3300余家上市公司发布2023年度分红预案。记者梳理发现，A股公司分红呈现出三大特点：上市公司大手笔分红及多次分红频现，多年一毛不拔的“铁公鸡”公司计划分红了，高股息板块愈发受投资者青睐。 (证券日报),3300余家A股公司发布2023年度分红预案，大手笔分红等三大特点亮眼
2024-04-29 06:34:55,受多重利好因素影响，港股市场本周持续走强，一批布局港股的公募基金净值迎来大涨。从基金一季报来看，随着港股性价比的不断提升，不少QDII基金一季度加大了对港股的配置。对于港股后市，多位基金经理一致看好，将重点关注互联网、创新药等行业。数据显示，截至4月26日，香港恒生指数本周实现五连阳，涨幅达8.8%，并创下今年以来的新高。同期，被公募基金重仓的腾讯控股、美团-W、快手-W涨幅明显，涨幅分别为14.68%、21.3%和27.4%。 (上证报),港股吸引力提升，QDII基金纷纷加仓
2024-04-29 06:34:26,文章称，结合外商投资新形势新要求，尽快建立外商投资准入前国民待遇及负面清单管理制度，推动相关法律、法规以及规范性文件修订完善。各地应结合发展实际，以项目化、清单化优惠政策，鼓励外资加大对先进制造、高技术、节能环保、生物医药等产业的投资力度，中西部地区更要围绕适用技术、民生消费等领域与东部地区加强对接，促进外商投资梯度转移。试点扩大进口自用设备免征关税政策适用范围，积极落实相关优惠政策。基于利益共享、风险共担原则，推动外资企业合规、合法在境内开展融资融券、跨境贸易、投资结算等服务。,经济日报：着力解决外资企业所需所盼
2024-04-29 06:32:27,"① 待定 国内成品油将开启新一轮调价窗口；

② 17:00 欧元区4月经济景气、工业景气指数等；

③ 美国4月达拉斯联储商业活动指数。

微信小程序搜索“见闻历”，了解更多。",提醒：日内请重点关注（以下均为北京时间）
2024-04-29 06:26:03,29日24时，国内成品油新一轮调价窗口将正式开启。综合机构观点，成品油价格将迎来2024年的第二次下跌。隆众资讯成品油分析师刘炳娟表示，按照国内成品油调价机制，4月30日当天国内汽柴油下跌幅度约为80元/吨，以70升的油箱计算，私家车主加满一箱油将少花3.5元左右。今年以来，国内成品油调价已呈现“五涨一跌两搁浅”格局，汽、柴油每吨分别累计涨875元、845元。若本轮调价落地，年内成品油调价将为“五涨两跌两搁浅”。（中新经纬）,年内第二跌！节前成品油价或下调，加满一箱少花3.5元
2024-04-29 06:25:29,标品信托产品的发行和成立数量近期连续增长，其中固收类信托产品占据主导地位。业内人士分析称，债牛令市场做多情绪升温，进而推动固收类信托产品发行量增长。展望后市，债券市场仍然具备配置价值，但市场波动可能加剧，建议投资者采取谨慎偏防御的投资策略。 (上证报),做多情绪助推，标品信托发行与成立双回升
2024-04-29 06:21:27,中央气象台4月29日06时继续发布暴雨黄色预警：预计，4月29日08时至30日08时，湖北西部和东南部、安徽南部、浙江西南部、四川盆地东部、重庆、贵州东部、湖南、江西、福建西部、广西东北部、广东中北部等地部分地区有大到暴雨，其中，湖南中部、江西中部、贵州东南部、广西东北部等地部分地区有大暴雨（100～200毫米）。上述部分地区伴有短时强降水（最大小时降雨量30～60毫米，局地可超过80毫米），局地有雷暴大风或冰雹等强对流天气。,中央气象台4月29日06时继续发布暴雨黄色预警
2024-04-29 06:19:45,今年一季度，A股上市公司购买各类型理财产品的意愿降至近5年冰点。无论是购买理财产品的公司数量，还是认购的理财产品数量与总金额，均创下近5年同期水平新低。2020年至2023年一季度，上市公司购买理财产品的规模波动幅度并不大，均稳定在3300亿元至3700亿元区间。不过，2024年一季度该项数据出现严重缩水，仅为1282亿元，较上一年同期下降60.32%。据记者不完全统计，2023年以来，已有20余家A股上市公司公告“踩雷”中融信托旗下产品。上述风险事件发生后，上市公司购买信托产品的规模明显减少。（证券时报）,一季度上市公司认购理财产品规模降六成， “避雷”意识是一大诱因
2024-04-29 06:15:55,新“国九条”相较于2004年和2014年的两份“国九条”，在多方面呈现出显著变化，最引人瞩目的是对资本市场监管体系全面升级。其中，建立中介机构“黑名单”制度，无疑将成为提升市场监管效率、促进中介机构归位尽责、震慑违法违规行为的重要举措。,压实中介机构“看门人”责任，“黑名单”制度强化发行上市全链条监管
2024-04-29 06:10:22,文章称，企业财务舞弊屡禁不止，其中重要原因是处罚没有真正实现“长牙带刺”。法律需要与时俱进修订完善，还要通过丰富监管手段、严格执法程序，充分落实法律责任规定，让财务造假者无所遁形，并付出沉重代价。徒法不足以自行。“长牙带刺”不应只停留在法律条文上，还应在监管执法上充分体现。要通过丰富监管手段、严格执法程序，充分落实法律责任规定，让财务造假者无所遁形，并付出沉重的代价。,经济日报：打击财务造假务必“长牙带刺”
2024-04-29 06:08:44,"周一（4月29日）亚太盘初，标普500股指期货和纳斯达克100股指期货涨约0.1%。

WTI原油期货跌0.1%，报83.58美元/桶；布伦特原油期货跌0.3%，交投于88.00美元下方。

COMEX黄金期货跌0.2%，暂报2345美元/盎司。",
2024-04-29 05:42:19,"据知情人士透露，亿万富翁、皮肤护理公司L’Occitane International SA（欧舒丹）所有人Reinold Geiger接近提议将L’Occitane私有化，对该公司的估值大约65亿欧元（折合70亿美元，含债务）。

黑石集团和高盛集团将为这笔潜在的买断交易提供资金支持。

预计潜在买家最快将于周一宣布。（彭博）",报道：亿万富翁Geiger拟以约70亿美元将欧舒丹私有化
2024-04-29 00:05:38,"周日（4月28日），沙特证交所全股指数收跌0.19%，报12231.54点。

卡塔尔证交所指数收涨0.31%，报9667.18点。

科威特证交所超级市场价格回报指数收跌0.13%，报7653.54点。

埃及证交所EGX 30指数收跌4.93%，报24639.63点。

埃及镑兑美元涨0.02%，报47.8902埃及镑。

以色列股市休市。",中东股市｜沙特股指收跌约0.2%，埃及股指跌超4.9%
